Retailer,StoreID,StoreName,StoreAddress,StoreCity,StoreState,Zipcode,Country,Latitude,Longitude,Phone
"Jollibee GrabFood","2-CZLJTFCXFAMWN2","Jollibee - Binakayan","Tirona Highway, Binakayan-Kanluran, Binakayan, Kawit, Cavite, Calabarzon, 4104, Philippines","Kawit","CAV","4104","PH","14.449694","120.922855",
"Jollibee GrabFood","2-C6VVMADJRRDYAJ","Jollibee - Binakayan Highway","Jollibee, Antero Soriano Highway, Tramo-Bantayan, Binakayan, Kawit, Cavite, Calabarzon, 4104, Philippines","Kawit","CAV","4104","PH","14.444879","120.914703",
"Jollibee GrabFood","2-CY2CR65HMGJFRX","Jollibee - Imus Pagasa","Gahak Road, Pag-asa III, Imus, Cavite, Calabarzon, 4103, Philippines","Imus","CAV","4103","PH","14.441349","120.91136238095",
"Jollibee GrabFood","2-CZLJTFCXEATGLN","Jollibee - Dasma DBB","Jollibee, Congressional Avenue, Santa Lucia, Bagong Bayan, Dasmarinas, Cavite, Calabarzon, 4115, Philippines","Dasmarinas","CAV","4115","PH","14.3345351","120.95388935",
"Jollibee GrabFood","2-C6NBNREDGACYTJ","Jollibee - Camerino","Jollibee, Aguinaldo Highway, Zone 1, Poblacion, Dasmarinas, Cavite, Calabarzon, 4114, Philippines","Dasmarinas","CAV","4114","PH","14.32949785","120.9394576",
"Jollibee GrabFood","2-CZLJTFCXJJWBMA","Jollibee - Dasma Bayan","Don Placido Campos Avenue, Zone 4, Poblacion, Dasmarinas, Cavite, Calabarzon, 4114, Philippines","Dasmarinas","CAV","4114","PH","14.326201","120.936178",
"Jollibee GrabFood","2-CZLJTFCXFCM1KA","Jollibee - WM Dasma","Pickup Coffee, Aguinaldo Highway, Zone 4, Poblacion, Dasmarinas, Cavite, Calabarzon, 4114, Philippines","Dasmarinas","CAV","4114","PH","14.325686","120.940854",
"Jollibee GrabFood","2-CZLJTFCXEZKAJ6","Jollibee - Dasma Paliparan","Paliparan Road, Phase 3, Paliparan 3, Paliparan, Dasmarinas, Cavite, Calabarzon, 4114, Philippines","Dasmarinas","CAV","4114","PH","14.3205728","120.98493258",
"Jollibee GrabFood","2-CZLJTFCXJAU2J6","Jollibee - SM Market Mall","SM Marketmall Dasmarinas, Congressional Avenue, Burol 1, Bagong Bayan, Dasmarinas, Cavite, Calabarzon, 4115, Philippines","Dasmarinas","CAV","4115","PH","14.3280885","120.959571",
"Jollibee GrabFood","2-CZLJTFCXEXWVC6","Jollibee - FCIE Dasmarinas","Jollibee, Governors Drive, Langkaan 2, Langkaan, Dasmarinas, Cavite, Calabarzon, 4126, Philippines","Dasmarinas","CAV","4126","PH","14.292201","120.932123",
"Jollibee GrabFood","2-C2MGJT3YRE23AX","Jollibee - Gentri Highway","Jollibee, Governors Drive, Manggahan, General Trias, Cavite, Calabarzon, 4107, Philippines","General Trias","CAV","4107","PH","14.292034752257","120.91229230072",
"Jollibee GrabFood","2-C2NHUA3TNF5CTT","Jollibee - Waltermart Gentri","Governors Drive, Manggahan, General Trias, Cavite, Calabarzon, 4107, Philippines","General Trias","CAV","4107","PH","14.29173606","120.9085071",
"Jollibee GrabFood","2-C2BGN7CUN4LBLJ","Jollibee - Robinsons Dasma","Main Building, Aguinaldo Highway, Sampaloc 1, Sampaloc, Dasmarinas, Cavite, Calabarzon, 4114, Philippines","Dasmarinas","CAV","4114","PH","14.300190254916","120.95415052841",
"Jollibee GrabFood","2-C3CKCVEUNN6WME","Jollibee - NAIC Drive Thru Highway","Jollibee, Governors Drive, Ibayo Silangan, Naic, Cavite, Calabarzon, 4110, Philippines","Naic","CAV","4110","PH","14.321501","120.771949",
"Jollibee GrabFood","2-C7DBRFV2HE3TRE","Jollibee - Waltermart Naic","Makina, Naic, Cavite, Calabarzon, 4110, Philippines","Naic","CAV","4110","PH","14.319","120.777",
"Jollibee GrabFood","2-CY2GPCDZEVN1JA","Jollibee - Shaw Wack Wack","Jollibee, 537, Shaw Boulevard, Wack-Wack Greenhills, Mandaluyong, Eastern Manila District, Metro Manila, 1552, Philippines","Mandaluyong","NCR","1552","PH","14.586178541183","121.0479034",
"Jollibee GrabFood","2-CZADRF6BV8NFRA","Jollibee - Starmall","Jollibee, Starmall Service Road, Wack-Wack Greenhills, Mandaluyong, Eastern Manila District, Metro Manila, 1555, Philippines","Mandaluyong","NCR","1555","PH","14.58262","121.053659",
"Jollibee GrabFood","2-CY2WV3D3RB2YVN","Jollibee - Edsa Central","Jollibee, EDSA, Highway Hills, Mandaluyong, Eastern Manila District, Metro Manila, 1553, Philippines","Mandaluyong","NCR","1553","PH","14.5801271","121.0532427",
"Jollibee GrabFood","2-C2XBJ2X1T2VTCA","Jollibee - Guiguinto Highway","Farmers Savings & Loan Bank, Dona Remedios Trinidad Highway, Dona Pilar Homes, Guiguinto, Bulacan, Central Luzon, 3015, Philippines","Guiguinto","BUL","3015","PH","14.841636","120.861033",
"Jollibee GrabFood","2-C2XBJ2X2BGL2HE","Jollibee - Santa Cruz Guiguinto","Tikay Bridge, MacArthur Highway, Tikay, Malolos, Bulacan, Central Luzon, 3015, Philippines","Malolos","BUL","3015","PH","14.839157006068","120.85944458083",
"Jollibee GrabFood","2-C2XBJ2X2BCJHSE","Jollibee - Plaridel Highway","Mercury Drug, Dona Remedios Trinidad Highway, Sitio Santiago Subdivision, Lalangan, Plaridel, Bulacan, Central Luzon, 3004, Philippines","Plaridel","BUL","3004","PH","14.87243","120.862062",
"Jollibee GrabFood","2-C2XBJ2X2APEFNX","Jollibee - Waltermart Guiguinto","Jollibee, MacArthur Highway, Golden Ville Subdivision, Masagana Homes, Guiguinto, Bulacan, Central Luzon, 3015, Philippines","Guiguinto","BUL","3015","PH","14.8282044","120.8739279",
"Jollibee GrabFood","2-CZCVA7DKNBA3CE","Jollibee - SM City Marikina","BDO, Marcos Highway, Calumpang, District I, Marikina, Eastern Manila District, Metro Manila, 1801, Philippines","Marikina","NCR","1801","PH","14.625929","121.084248",
"Jollibee GrabFood","2-CY2GPCDZCCN2R6","Jollibee - Ayala Feliz","Marcos Highway, Dela Paz, Pasig Second District, Pasig, Eastern Manila District, Metro Manila, 1610, Philippines","Pasig","NCR","1610","PH","14.620143295","121.09378468571",
"Jollibee GrabFood","2-CYMDHELZTUWXJX","Jollibee - Riverbanks North Triangle","Riverbanks Center, Riverbanks Access Road, Barangka, District I, Marikina, Eastern Manila District, Metro Manila, 1803, Philippines","Marikina","NCR","1803","PH","14.632312","121.083606",
"Jollibee GrabFood","2-CZKCBEUXAXBCRJ","Jollibee - Marikina Riverbanks","Riverbanks Center, Riverbanks Access Road, Barangka, District I, Marikina, Eastern Manila District, Metro Manila, 1803, Philippines","Marikina","NCR","1803","PH","14.63172","121.082959",
"Jollibee GrabFood","2-CYLTTU5WJXC3KE","Jollibee - Amang Rodriguez","Jollibee, Amang Rodriguez Avenue, Purok 10, Dela Paz, Pasig Second District, Pasig, Eastern Manila District, Metro Manila, 1610, Philippines","Pasig","NCR","1610","PH","14.618331","121.092755",
"Jollibee GrabFood","2-CY2CR65HJT6ZN2","Jollibee - Paseo de Sta Rosa","Santa Rosa-Tagaytay Road, Don Jose, Santa Rosa, Laguna, Calabarzon, 4026, Philippines","Santa Rosa","LAG","4026","PH","14.2483193","121.0631948",
"Jollibee GrabFood","2-CY2GPCDZAUVUME","Jollibee - Vistamall Sta. Rosa","Jollibee, Santa Rosa-Tagaytay Road, Santo Domingo, Santa Rosa, Laguna, Calabarzon, 4026, Philippines","Santa Rosa","LAG","4026","PH","14.2421978","121.05773",
"Jollibee GrabFood","2-C2CHJ4JGL6CXAA","Jollibee - Tarlac Highway","Jollibee, MacArthur Highway, Lazatin Subdivision, Tarlac City, Tarlac, Central Luzon, 2300, Philippines","Tarlac City","TAR","2300","PH","15.480853","120.595093",
"Jollibee GrabFood","2-C2CHJ4JGLZMVLA","Jollibee - Metrotown","Metro Town Mall, MacArthur Highway, Santo Cristo, Tarlac City, Tarlac, Central Luzon, 2300, Philippines","Tarlac City","TAR","2300","PH","15.487493","120.59658486",
"Jollibee GrabFood","2-C2CDTF5BWBV2KA","Jollibee - SM Tarlac","Sweet Stems, MacArthur Highway, Lazatin Subdivision, Tarlac City, Tarlac, Central Luzon, 2300, Philippines","Tarlac City","TAR","2300","PH","15.476914","120.594899",
"Jollibee GrabFood","2-CY2CR65KNPEXE6","Jollibee - Quirino Highway Talipapa","Quirino Highway, Villa Florencia Subdivision, Talipapa, 6th District, Quezon City, Eastern Manila District, Metro Manila, 1116, Philippines","Quezon City","NCR","1116","PH","14.686332","121.02436",
"Jollibee GrabFood","2-CY2CR65KGE4JEX","Jollibee - Kingspoint Sauyo","King Alexander Street, Talipapa, Bagbag, 6th District, Quezon City, Eastern Manila District, Metro Manila, 1116, Philippines","Quezon City","NCR","1116","PH","14.693027000719","121.02972482169",
"Jollibee GrabFood","2-C4EVEU6XFCB1NN","Jollibee - Robinsons Place Tuguegarao","Maharlika Highway, Tanza, Balzain West, Tuguegarao, Cagayan, Cagayan Valley, 3500, Philippines","Tuguegarao","CAG","3500","PH","17.62745984","121.7326421",
"Jollibee GrabFood","2-C35DNXJHUGBFV2","Jollibee - Tuguegarao Tanza Junction","Tanza Circle, Tanza, Balzain West, Tuguegarao, Cagayan, Cagayan Valley, 3500, Philippines","Tuguegarao","CAG","3500","PH","17.62655101","121.7327149",
"Jollibee GrabFood","2-C6NABGDALK51NN","Jollibee - Citymall Tuguegarao","Maharlika Highway, Leonarda, Balzain West, Tuguegarao, Cagayan, Cagayan Valley, 3500, Philippines","Tuguegarao","CAG","3500","PH","17.63317044","121.7351339",
"Jollibee GrabFood","2-C3NKTETBVJUAFA","Jollibee - Tuguegarao Bonifacio","Jollibee, Bonifacio Street, Centro IV, Centro VII, Balzain West, Tuguegarao, Cagayan, Cagayan Valley, 3500, Philippines","Tuguegarao","CAG","3500","PH","17.614086","121.728221",
"Jollibee GrabFood","2-C3NKTED1VFDANJ","Jollibee - Tuguegarao Citimall","Bonifacio Street, Centro IV, Centro X, Balzain West, Tuguegarao, Cagayan, Cagayan Valley, 3500, Philippines","Tuguegarao","CAG","3500","PH","17.61168093","121.7284344",
"Jollibee GrabFood","2-C3NKTAVCBEMASA","Jollibee - SM Tuguegarao","SM Center Tuguegarao Downtown, Luna Street, Perpetual Village, Pallua Sur, Tuguegarao, Cagayan, Cagayan Valley, 3500, Philippines","Tuguegarao","CAG","3500","PH","17.61317379","121.7236663",
"Jollibee GrabFood","2-C6WHCP53GPW2CN","Jollibee - Enrile Boulevard Tuguegarao","Tuguegarao City Hall, 5, Enrile Boulevard, Caggay, Tuguegarao, Cagayan, Cagayan Valley, 3500, Philippines","Tuguegarao","CAG","3500","PH","17.649885","121.753464",
"Jollibee GrabFood","2-C4EEJ8JERLLFGJ","Jollibee - SM Tuguegarao Level 1","SM City Tuguegarao, Tuguegarao Diversion Road , Caritan Centro, Caritan Norte, Tuguegarao, Cagayan, Cagayan Valley, 3500, Philippines","Tuguegarao","CAG","3500","PH","17.62741285","121.7178146",
"Jollibee GrabFood","2-C4JYKFJFVAAFPE","Jollibee - SM Center Tuguegarao Downtown","SM Center Tuguegarao Downtown, Luna Street, Perpetual Village, Pallua Sur, Tuguegarao, Cagayan, Cagayan Valley, 3500, Philippines","Tuguegarao","CAG","3500","PH","17.61314325","121.7237526",
"Jollibee GrabFood","2-C2XBJ2X2ANBWNX","Jollibee - Pulong Buhangin","Jollibee, Norzagaray-Santa Maria Road, Pulong Buhangin, Pulong Yantok, Santa Maria, Bulacan, Central Luzon, 3022, Philippines","Santa Maria","BUL","3022","PH","14.86503","120.994102",
"Jollibee GrabFood","2-C63UC4JUVN4ZC2","Jollibee - Pandi","Jollibee, Pandi - Angat Road, Siling Bata, Pandi, Bulacan, Central Luzon, 3022, Philippines","Pandi","BUL","3022","PH","14.886337360405","120.96569708522",
"Jollibee GrabFood","2-C3M2N8CAGKXAFA","Jollibee - Talamban Proper DT","Metrobank, M. Cuenco Avenue, Talamban, Cebu City, Central Visayas, 6014, Philippines","Cebu City","NCR","6014","PH","10.369106","123.916748",
"Jollibee GrabFood","2-CYNBNZMWCNJHNX","Jollibee - Gaisano Grand Talamban","M. Cuenco Avenue, Talamban, Cebu City, Central Visayas, 6014, Philippines","Cebu City","NCR","6014","PH","10.366932966935","123.91378606752",
"Jollibee GrabFood","2-CY2CR65TAZLJVT","Jollibee - Ayala Cloverleaf","Cloverleaf Drive, Balingasa, Balintawak, 1st District, Quezon City, Eastern Manila District, Metro Manila, 1405, Philippines","Quezon City","NCR","1405","PH","14.655596","121.000069",
"Jollibee GrabFood","2-C4LALK3JNK3FAX","Jollibee - Shell EDSA Balintawak","Shell Shop, EDSA, Kangkong, Apolonio Samson, Balintawak, 6th District, Quezon City, Eastern Manila District, Metro Manila, 1106, Philippines","Quezon City","NCR","1106","PH","14.657767","121.007644",
"Jollibee GrabFood","2-CY2CR65KG4DGLN","Jollibee - Bagong Barrio Kalookan","EDSA, Barangay 139, Zone 12, Bagong Barrio West, District 1, Caloocan, Northern Manila District, Metro Manila, 1405, Philippines","Caloocan","NCR","1405","PH","14.65747","120.998001",
"Jollibee GrabFood","2-CY2WV3D3CUKKT6","Jollibee - Sto Domingo","Jollibee, MacArthur Highway, Santo Domingo, Calibutbut, Angeles, Central Luzon, 2009, Philippines","Angeles","PAM","2009","PH","15.1259308","120.5981739",
"Jollibee GrabFood","2-CZD2E23KRGB3C2","Jollibee - Jenra Mall","Jenra Mall Underground Parking, Santo Rosario Street, Santo Rosario, Angeles, Central Luzon, 1992, Philippines","Angeles","PAM","1992","PH","15.1361792","120.5879164",
"Jollibee GrabFood","2-C4BEVTVWG64CEX","Jollibee - Nepo Mall Angeles","Nepo Mall Open Parking, Kenneth Street, Villa Teresa Subdivision, Angeles, Central Luzon, 1992, Philippines","Angeles","PAM","1992","PH","15.13469133","120.588368",
"Jollibee GrabFood","2-CZKCBEUXAZKAET","Jollibee - Antipolo Oliveros","Jollibee, Pascual Oliveros Street, San Roque, Antipolo, Rizal, Calabarzon, 1910, Philippines","Antipolo","RIZ","1910","PH","14.587694299128","121.17543772741",
"Jollibee GrabFood","2-CYNAWA2GV26JT6","Jollibee - SM City Bicutan","SM City Bicutan, Dona Soledad Avenue, Don Bosco, Paranaque District 2, Paranaque, Southern Manila District, Metro Manila, 1711, Philippines","Paranaque","NCR","1711","PH","14.486655","121.043669",
"Jollibee GrabFood","2-CY2CR65KTPVCMA","Jollibee - Puregold Maypajo","J. P. Rizal Street, Barangay 33, Zone 3, Maypajo, District 2, Caloocan, Northern Manila District, Metro Manila, 1410, Philippines","Caloocan","NCR","1410","PH","14.637834","120.974898",
"Jollibee GrabFood","2-CY2CR65JSACVBE","Jollibee - 5th Avenue","7-Eleven, Rizal Avenue Extension, Barangay 117, Zone 10, Grace Park East, District 2, Caloocan, Northern Manila District, Metro Manila, 1406, Philippines","Caloocan","NCR","1406","PH","14.644014","120.983667",
"Jollibee GrabFood","2-C3XANVDGG7CGGX","Jollibee - Cabanatuan Diversion Road","Jollibee, Maharlika Highway, San Juan Poblacion, Cabanatuan, Nueva Ecija, Central Luzon, 3100, Philippines","Cabanatuan","NUE","3100","PH","15.452132","120.946759",
"Jollibee GrabFood","2-C3NKTED1VNMZRE","Jollibee - N.E. Pacific Mall, Cabanatuan City","NE Pacific Mall, Felipe Vergara Highway, Hilltop Subdivision, Cabanatuan, Nueva Ecija, Central Luzon, 3100, Philippines","Cabanatuan","NUE","3100","PH","15.459311","120.950101",
"Jollibee GrabFood","2-C3XARGBXVYLETN","Jollibee - SM Cabanatuan","SM City Cabanatuan, Maharlika Highway, San Juan Poblacion, Cabanatuan, Nueva Ecija, Central Luzon, 3100, Philippines","Cabanatuan","NUE","3100","PH","15.46712759","120.9540342",
"Jollibee GrabFood","2-C3NKTA6UT4AFAE","Jollibee - Cabanatuan Circumferential","Jollibee, Maharlika Highway, San Juan Poblacion, Cabanatuan, Nueva Ecija, Central Luzon, 3100, Philippines","Cabanatuan","NUE","3100","PH","15.4704612","120.9556205",
"Jollibee GrabFood","2-C3X1AFVHGVC2AA","Jollibee - SM Megacenter Cabanatuan","General Tinio Street, Maria Teresa, Isla, Cabanatuan, Nueva Ecija, Central Luzon, 3100, Philippines","Cabanatuan","NUE","3100","PH","15.48697974","120.9683329",
"Jollibee GrabFood","2-C3XANVDGG3EBLT","Jollibee - Waltermart Cabanatuan","Maharlika Highway, Maria Teresa, Isla, Cabanatuan, Nueva Ecija, Central Luzon, 3100, Philippines","Cabanatuan","NUE","3100","PH","15.48604061","120.9720876",
"Jollibee GrabFood","2-C2CHJ4JGG6V2CA","Jollibee - Ayala Centrio","Centrio Mall, C. M. Recto Avenue, Barangay 24, Poblacion, Cagayan de Oro, Northern Mindanao, 9000, Philippines","Cagayan de Oro","MOR","9000","PH","8.485577","124.650665",
"Jollibee GrabFood","2-C2UTG3KVVE4BC6","Jollibee - Gaisano Mall CDO","Jollibee, C. M. Recto Avenue, Barangay 24, Poblacion, Cagayan de Oro, Northern Mindanao, 9000, Philippines","Cagayan de Oro","MOR","9000","PH","8.486004","124.651215",
"Jollibee GrabFood","2-C2CHJ4JGGLL2CT","Jollibee - Limketkai Gateway","Innovuze Solutions Incorporated, Limketkai Skywalk, Limketkai Center, Lapasan, Cagayan de Oro, Northern Mindanao, 9000, Philippines","Cagayan de Oro","MOR","9000","PH","8.4843899","124.6564391",
"Jollibee GrabFood","2-C3KYKEEDAPMKTT","Jollibee - SM CDO Downtown","SM CDO Downtown Premier, C. M. Recto Avenue, Barangay 26, Poblacion, Cagayan de Oro, Northern Mindanao, 9000, Philippines","Cagayan de Oro","MOR","9000","PH","8.4845587","124.6542279",
"Jollibee GrabFood","2-C6D2CVJBCF5CVA","Jollibee - Limketkai","Limketkai (East Concourse), Limketkai Avenue, Limketkai Center, Lapasan, Cagayan de Oro, Northern Mindanao, 9000, Philippines","Cagayan de Oro","MOR","9000","PH","8.481702536","124.6574003",
"Jollibee GrabFood","2-CZJVNKXHTJXHCE","Jollibee - Market City","Jollibee, Santo Nino Street, Mambato, Lapasan, Cagayan de Oro, Northern Mindanao, 9000, Philippines","Cagayan de Oro","MOR","9000","PH","8.4890988","124.6585202",
"Jollibee GrabFood","2-CYLTTKM2G2BJAT","Jollibee - Nova Square","Mercury Drug, Quirino Highway, San Bartolome, 5th District, Quezon City, Eastern Manila District, Metro Manila, 1116, Philippines","Quezon City","NCR","1116","PH","14.701247504286","121.03507648451",
"Jollibee GrabFood","2-CYLTTU4HHGLJR6","Jollibee - Signal Village","Mayor Tanyag, South Signal Village, Signal Village, Taguig District 2, Taguig, Southern Manila District, Metro Manila, 1633, Philippines","Taguig","NCR","1633","PH","14.504628","121.052996",
"Jollibee GrabFood","2-CZE2LX4GFAMXLE","Jollibee - Waterfun","Marichu R. Tinga Avenue, North Signal Village, Signal Village, Taguig District 2, Taguig, Southern Manila District, Metro Manila, 1633, Philippines","Taguig","NCR","1633","PH","14.515052","121.05217",
"Jollibee GrabFood","2-C7BCSCDEERJZTA","Jollibee - M.L. Quezon Taguig","New RPG Construction Supply, Manuel L. Quezon Avenue, Acacia Kaliwa, New Lower Bicutan, Taguig District 1, Taguig, Southern Manila District, Metro Manila, 1633, Philippines","Taguig","NCR","1633","PH","14.507856","121.066231",
"Jollibee GrabFood","2-CYLTTU5FEB2HJ6","Jollibee - Sunshine Mall","Sunshine Plaza Mall, Arca Boulevard, Western Bicutan, Taguig District 2, Taguig, Southern Manila District, Metro Manila, 1713, Philippines","Taguig","NCR","1713","PH","14.505290354828","121.04089861928",
"Jollibee GrabFood","2-C2CGFCEYL7BKLJ","Jollibee - Legazpi Imperial","L. Los Banos Avenue, Tinago, Legazpi, Albay, Bicol Region, 4500, Philippines","Legazpi","ALB","4500","PH","13.146027","123.750786",
"Jollibee GrabFood","2-C2NHUA3TNF6UJJ","Jollibee - Ayala Malls Legazpi","Ayala Malls Legazpi, Rizal Street, Tinago, Legazpi, Albay, Bicol Region, 4500, Philippines","Legazpi","ALB","4500","PH","13.147266745208","123.75229575592",
"Jollibee GrabFood","2-C2JDJNUTUATCHA","Jollibee - LCC Legazpi","Jollibee, Penaranda Street, Dinagaan, Legazpi, Albay, Bicol Region, 4500, Philippines","Legazpi","ALB","4500","PH","13.147207","123.753716",
"Jollibee GrabFood","2-C2CGFCEYN2KYEN","Jollibee - Legazpi Rizal","Maria Clara Street, Ilawod, Legazpi, Albay, Bicol Region, 4500, Philippines","Legazpi","ALB","4500","PH","13.13871","123.736115",
"Jollibee GrabFood","2-C2CGFCEYPBNFV6","Jollibee - SM City Legaspi","SM City Legazpi, Terminal Road 2, Cabagnan West, Legazpi, Albay, Bicol Region, 4500, Philippines","Legazpi","ALB","4500","PH","13.144279","123.743988",
"Jollibee GrabFood","2-CZEVRBABNEJWRX","Jollibee - Upper Session Rd Extension","Jollibee, Utility Road, Bal Marcoville, District 2, Baguio, Cordillera Administrative Region, 2600, Philippines","Baguio","BEN","2600","PH","16.4053146","120.6024052",
"Jollibee GrabFood","2-CZDHR3BKLYDDME","Jollibee - SM Baguio Supermarket","Sweet Blossoms, Luneta Hill Drive, Session Road, District 10, Baguio, Cordillera Administrative Region, 2600, Philippines","Baguio","BEN","2600","PH","16.40964887","120.5995033",
"Jollibee GrabFood","2-CZJVNKXHSFKGNT","Jollibee - SM Baguio","SM City Baguio, Luneta Hill Drive, Session Road, District 10, Baguio, Cordillera Administrative Region, 2600, Philippines","Baguio","BEN","2600","PH","16.408513","120.599862",
"Jollibee GrabFood","2-CZD2E23KRRJKLX","Jollibee - Baguio Harrison","Burnham Park, Legarda Road Extension, Purok 3, Burnham Legarda, District 4, Baguio, Cordillera Administrative Region, 2600, Philippines","Baguio","BEN","2600","PH","16.411714","120.596342",
"Jollibee GrabFood","2-CZMUWGNFRFEKWE","Jollibee - Baguio Upper Session","Murphys Fitness Gym, Patria de Baguio Stairs, Kabayanihan, District 18, Baguio, Cordillera Administrative Region, 2600, Philippines","Baguio","BEN","2600","PH","16.411779","120.598725",
"Jollibee GrabFood","2-C2CZRRLCHEADRJ","Jollibee - San Jose Claret","Jollibee, Ruste Drive, Ruste-Antonio Compound, Zamboanga City, Zamboanga Peninsula, 7000, Philippines","Zamboanga City","REG-IX","7000","PH","6.9125261808561","122.0653458887",
"Jollibee GrabFood","2-C2CZRRLCG7BUVE","Jollibee - Zambo Climaco","Mayor Cesar C. Climaco Avenue, Zone IV, Santa Catalina, Zamboanga City, Zamboanga Peninsula, 7000, Philippines","Zamboanga City","REG-IX","7000","PH","6.9057430055665","122.07521018444",
"Jollibee GrabFood","2-C2CZRRLCJNXKLX","Jollibee - Zamboanga Gov Lim","La Purisima Street, Zone IV, Santa Catalina, Zamboanga City, Zamboanga Peninsula, 7000, Philippines","Zamboanga City","REG-IX","7000","PH","6.9063598","122.0763171",
"Jollibee GrabFood","2-C2CZRRLCJT4KRN","Jollibee - Zamboanga Pilar","The Gateway Mall, Governor Lim Avenue, Zone IV, Santa Catalina, Zamboanga City, Zamboanga Peninsula, 7000, Philippines","Zamboanga City","REG-IX","7000","PH","6.9064948","122.0771954",
"Jollibee GrabFood","2-C2CZRRLCG73KA2","Jollibee - Zambo Pershing","Jollibee, Rizal Street, Zone IV, Santa Catalina, Zamboanga City, Zamboanga Peninsula, 7000, Philippines","Zamboanga City","REG-IX","7000","PH","6.9046899390623","122.07673875866",
"Jollibee GrabFood","2-C2CZRRLCHFKWAT","Jollibee - Zambo Veterans","Jollibee, Veterans Avenue, Tetuan, Santa Catalina, Zamboanga City, Zamboanga Peninsula, 7000, Philippines","Zamboanga City","REG-IX","7000","PH","6.914046","122.079819",
"Jollibee GrabFood","2-C2CZRRLCJVKEAA","Jollibee - Gusu Yubenco","Yubenco, 1, San Roque Road, Southcom Village, San Roque, Zamboanga City, Zamboanga Peninsula, 7000, Philippines","Zamboanga City","REG-IX","7000","PH","6.9208603220466","122.04786577086",
"Jollibee GrabFood","2-C2CZRRLCJJXKGN","Jollibee - Zambo Sta. Cruz","Jollibee, Maria Clara L. Lobregat Highway, Tetuan, Santa Maria, Zamboanga City, Zamboanga Peninsula, 7000, Philippines","Zamboanga City","REG-IX","7000","PH","6.921875","122.079746",
"Jollibee GrabFood","2-C2CZRRLCJBUBJJ","Jollibee - KCC Mall de Zamboanga","Jollibee, Governor Camins Avenue, Zone , Santa Maria, Zamboanga City, Zamboanga Peninsula, 7000, Philippines","Zamboanga City","REG-IX","7000","PH","6.920921","122.073196",
"Jollibee GrabFood","2-C2CZRRLCJE2ZJ2","Jollibee - Zambo Camins","Metrobank, Governor Camins Avenue, Zone , Santa Maria, Zamboanga City, Zamboanga Peninsula, 7000, Philippines","Zamboanga City","REG-IX","7000","PH","6.920828","122.072662",
"Jollibee GrabFood","2-C2CZRRLCGA2ZEJ","Jollibee - CityMall Tetuan","Citimall, Don Alfaro Street, Tetuan, Santa Catalina, Zamboanga City, Zamboanga Peninsula, 7000, Philippines","Zamboanga City","REG-IX","7000","PH","6.914319","122.08223",
"Jollibee GrabFood","2-C22JWEBYT24CAJ","Jollibee - Sto Nino Meycauayan","El Camino Real Street, Phase 3C Santo Nino, Meycauayan, Bulacan, Central Luzon, 3020, Philippines","Meycauayan","BUL","3020","PH","14.766372384065","120.9964587545",
"Jollibee GrabFood","2-C2XBJ2X1V34HGX","Jollibee - Ema Town Center","Jollibee, El Camino Real Street, Phase 3C Santo Nino, Meycauayan, Bulacan, Central Luzon, 3020, Philippines","Meycauayan","BUL","3020","PH","14.765705","120.991974",
"Jollibee GrabFood","2-C2XBJ2X2ACEJT6","Jollibee - Santa Maria Bypass Road","Santa Maria Bypass Road, Santa Clara, Santa Maria, Bulacan, Central Luzon, 3022, Philippines","Santa Maria","BUL","3022","PH","14.821403","120.9526805",
"Jollibee GrabFood","2-C2XBJ2X1V4C1NT","Jollibee - Waltermart Santa Maria","J.P. Rizal Street, Santa Clara, Santa Maria, Bulacan, Central Luzon, 3022, Philippines","Santa Maria","BUL","3022","PH","14.8230314","120.9541345",
"Jollibee GrabFood","2-C2XBJ2X1T32VCJ","Jollibee - Santa Maria","Jose Corazon de Jesus Street, Poblacion, Santa Maria, Bulacan, Central Luzon, 3022, Philippines","Santa Maria","BUL","3022","PH","14.818855863881","120.96142829451",
"Jollibee GrabFood","2-C24XRVC2EYDGJJ","Jollibee - Baycity Mall","Bay City Mall, D. Silang Street, Barangay 14, Poblacion, Batangas, Calabarzon, 4200, Philippines","Batangas","BTG","4200","PH","13.758825","121.057204",
"Jollibee GrabFood","2-C24VCYJBUF2FSA","Jollibee - Batangas Burgos","Jollibee, D. Silang Street, Barangay 10, Poblacion, Batangas, Calabarzon, 4200, Philippines","Batangas","BTG","4200","PH","13.759478","121.057991",
"Jollibee GrabFood","2-C24VCYJDVLKKPA","Jollibee - Batangas Rizal","Jollibee, Rizal Avenue, Barangay 16, Poblacion, Batangas, Calabarzon, 4200, Philippines","Batangas","BTG","4200","PH","13.75649743","121.0580044",
"Jollibee GrabFood","2-C24VCYJEJBKCPE","Jollibee - Waltermart Batangas","WalterMart, Recto Street, Purok 1 Lawas, Calicanto, Tramo, Batangas, Calabarzon, 4200, Philippines","Batangas","BTG","4200","PH","13.764052455394","121.05632608687",
"Jollibee GrabFood","2-C24VCYJDCJUZRJ","Jollibee - SM City Batangas","Jollibee, Concha A. Pastor Road, Pastor Village, Pallocan West, Batangas, Calabarzon, 4200, Philippines","Batangas","BTG","4200","PH","13.755273","121.069872",
"Jollibee GrabFood","2-C24VCYJCBB43GA","Jollibee - Pallocan","Jollibee, Manuela Q. Pastor Avenue, Pastor Village, Pallocan West, Batangas, Calabarzon, 4200, Philippines","Batangas","BTG","4200","PH","13.753861","121.068853",
"Jollibee GrabFood","2-CYLTTKLKRNADLJ","Jollibee - PGH Taft","Philippine Christian University, 1648, Pedro Gil Street, Barangay 678, Barangay 694, Malate, Fifth District, Manila, Capital District, Metro Manila, 1004, Philippines","Manila","NCR","1004","PH","14.57620601815","120.98842012988",
