Retailer,StoreID,StoreName,StoreAddress,StoreCity,StoreState,Zipcode,Country,Latitude,Longitude,Phone
"Jollibee PH","6dafaf90-57b2-4751-ab8c-47e993f0596f","JOLLIBEE CityMall Kabankalan","LEVEL 1 CITYMALL KABANKALAN JUSTICE PEREZ HIGHWAY TALUBANGI","Kabankalan","Negros Occidental","6111","PH","10.001048","122.809812","639985204976"
"Jollibee PH","b69435d6-910c-41fa-95c0-846f1eb83daf","JOLLIBEE CITYMALL ROXAS 2","LEVEL 1 CITYMALL ROXAS AVE ROXAS AVENUE POBLACION IV (BARANGAY IV)","Roxas","Capiz","5800","PH","11.576801628","122.752806302","639770163581"
"Jollibee PH","b1f56fc0-5ab4-4c38-ae0f-8e13c9bcede7","JOLLIBEE CityMall San Carlos","LEVEL 1 CITYMALL SAN CARLOS LEDESMA AVE. BARANGAY II (POB.)","San Carlos","Negros Occidental","6127","PH","10.48433","123.415979","639988567420"
"Jollibee PH","9a8959a9-1b78-43c0-b086-0d659530c1b5","JOLLIBEE CityMall Sorsogon","LEVEL 1 CITYMALL SORSOGON RIZAL STREET POBLACION","Sorsogon City","Sorsogon","4700","PH","12.970142","124.001015","639302683009"
"Jollibee PH","88dcb7cd-a5c0-468a-992a-9c6f429dc224","JOLLIBEE CityMall Tagum","LEVEL 1 CITYMALL TAGUM LAPU LAPU EXT. ST. MAGUGPO POBLACION","Tagum","Davao del Norte","8100","PH","7.445589","125.808662","639484170455"
"Jollibee PH","412b201b-d9a2-4971-975a-4e9ff09befce","JOLLIBEE CityMall Tarlac","LEVEL 1 CITYMALL TARLAC MCARTHUR HIGHWAY SAN RAFAEL","Tarlac City","Tarlac","2300","PH","15.46663","120.598976","639942395415"
"Jollibee PH","abeef48f-2e04-4a65-b8c6-f7cc140fe6ad","JOLLIBEE CityMall Tetuan","LEVEL 1 CITYMALL TETUAN DON ALFARO STREET TETUAN","Zamboanga City","Zamboanga Peninsula","7000","PH","6.914161","122.082445","639660448160"
"Jollibee PH","4a62f949-7f76-4105-a907-134be4891177","JOLLIBEE CityMall Tiaong","LEVEL 1 CITYMALL TIAONG MAHARLIKA HIGHWAY LALIG","Tiaong","Quezon","4325","PH","13.983206969","121.328350827","639189647728"
"Jollibee PH","453908c5-3927-452b-bec6-4ad69505cbc7","JOLLIBEE CityMall Tuguegarao","LEVEL 1 CITYMALL TUGUEGARAO PAN PHILIPPINE HIGHWAY LEONARDA","Tuguegarao","Cagayan","3500","PH","17.633244","121.735298","639056502741"
"Jollibee PH","fe59467e-453f-4ac4-a652-73a82325e2b1","JOLLIBEE Clark Berthaphil III","J. ABAD SANTOS AVENUE CUTCUT","Mabalacat","Pampanga","2023","PH","15.177567","120.53028","639156468047"
"Jollibee PH","82911b70-d92f-436e-8514-48fdd60d9050","JOLLIBEE COGEO","MARCOS HIGHWAY CORNER LUCBAN ROAD BAGONG NAYON","Antipolo","Rizal","1830","PH","14.620372","121.16933","639634425809"
"Jollibee PH","391f0d20-04cf-4dc3-9761-7b4b3b19f694","JOLLIBEE COLOURS TOWN CENTER","LEVEL 1 COLOURS TOWN CENTER ALABANG ZAPOTE ROAD COR MARCOS ALVAREZ AVE. TALON KUATRO","Las Pinas","Calabarzon","1740","PH","14.436705","121.006865","639357832256"
"Jollibee PH","8a702d9e-db18-475f-93cb-11f4647e0c96","JOLLIBEE COMMERCE","COMMERCE AVENUE ALABANG","Muntinlupa","Metro Manila","1783","PH","14.420078","121.035982","639399788432"
"Jollibee PH","fd181baa-ae13-4e1b-bacb-f1c55cfc14da","JOLLIBEE Commonwealth Batasan","CRISSANT COMMERCIAL BUILDING COMMONWEALTH AVE BATASAN HILLS","Quezon City","Metro Manila","1126","PH","14.683101","121.085953","639369532158"
"Jollibee PH","cb42665f-57e1-41cf-9968-5228e0959353","JOLLIBEE Commonwealth Mindanao","COMMONWEALTH AVENUE CORNER MINDANAO AVENUE NOVALICHES PROPER","Quezon City","Metro Manila","1118","PH","14.721784","121.052336","639199134210"
"Jollibee PH","d520a769-4d48-4148-b9af-3e094b3ccdf2","JOLLIBEE Commonwealth Soliven","HON. B. SOLIVEN STREET COMMONWEALTH","Quezon City","Metro Manila","1121","PH","14.701754","121.08676","639615130521"
"Jollibee PH","f46733e1-e2e0-4438-a686-26ed62902da4","JOLLIBEE Compostela","CENTRAL NAUTICAL HIGHWAY POBLACION","Compostela","Cebu","6003","PH","10.452792278","124.012759428","639171230589"
"Jollibee PH","be1da7ff-f16c-4a69-9e9a-6d20c86d1db9","JOLLIBEE Concepcion Malabon","GEN. LUNA STREET CORNER GOV. PASCUAL AVENUE CONCEPCION","Malabon","Metro Manila","1458","PH","14.669632","120.946855","639684478603"
"Jollibee PH","97f13c00-5ae3-4fa8-b806-1262f82f1121","JOLLIBEE Concepcion Tarlac","PROVINCIAL ROAD CORNER LOPEZ JAENA STREET SAN NICOLAS (POB.)","Concepcion","Tarlac","2316","PH","15.323107","120.653183","639188236412"
"Jollibee PH","7d259540-d7fc-4d01-8c8b-b34310f3fb44","JOLLIBEE CONVERGYS","LEVEL 1 CONVERGYS BUILDING AYALA AVENUE SAN LORENZO","Makati","Metro Manila","1226","PH","14.559426","121.016114","639167746617"
"Jollibee PH","a3911b1e-53af-41f2-9e17-a20e07da9563","JOLLIBEE Cotabato Plaza","SK PENDATUN AVENUE CORNER MAKAKUA STREET POBLACION I","Cotabato City","Caraga","9600","PH","7.223065","124.247148","639171673739"
"Jollibee PH","a80a7a2b-5eb8-4e33-b9f6-d7fccb41fd5b","JOLLIBEE Cotabato Quezon Avenue","QUEZON AVE POBLACION V","Cotabato City","Caraga","9600","PH","7.222554","124.252247","639518425034"
"Jollibee PH","7a5445c5-2106-4ad4-ab7b-0aeb590f5a97","JOLLIBEE Cotabato Sinsuat DT","SINSUAT AVENUE ROSARY HEIGHTS IX","Cotabato City","Caraga","9600","PH","7.201568","124.239135","639171533712"
"Jollibee PH","a6452592-45d1-47ad-b05d-45c4e567c327","JOLLIBEE C RAYMUNDO","C. RAYMUNDO AVENUE CANIOGAN","Pasig","Metro Manila","1606","PH","14.570706","121.08193","639190046374"
"Jollibee PH","50b1e91d-843f-4632-ac6a-f7bd02e8860f","JOLLIBEE Daanbantayan","NATIONAL HIGHWAY POBLACION","Daanbantayan","Cebu","6013","PH","11.249222885","124.001945775","639952896867"
"Jollibee PH","7d6b3f15-274e-4db6-8837-88ed1d396aa9","JOLLIBEE Daet Bayan","VINZONS AVENUE CORNER J. LUKBAN STREET BARANGAY V (POB.)","Daet","Camarines Norte","4600","PH","14.116368","122.954942","639614395797"
"Jollibee PH","6266e77d-974b-43e2-af80-4d66ede8e0b2","JOLLIBEE Daet Pimentel","VINZONS AVENUE CORNER PIMENTEL STREET BARANGAY VI (POB.)","Daet","Camarines Norte","4600","PH","14.115403","122.956262","639437088730"
"Jollibee PH","079206e1-d5be-401a-bb65-104a553862c2","JOLLIBEE Dagupan Perez","G FERNANDEZ BLDG PEREZ BOULEVARD CORNER GALVAN STREET BARANGAY II (NUEVA)","Dagupan","Pangasinan","2400","PH","16.040178","120.337478","639189494835"
"Jollibee PH","a303d147-5af6-44af-a4a9-d0c5d64d2f38","JOLLIBEE Dahlia","DAHLIA AVENUE FAIRVIEW","Quezon City","Metro Manila","1122","PH","14.700144","121.067504","639171371718"
"Jollibee PH","c51f0f26-afde-4bd3-9304-4054dfb8a165","JOLLIBEE Damortis Sto. Tomas","MANILA N RD DAMORTIS","Santo Tomas","La Union","4234","PH","16.240824","120.40627","639087873481"
"Jollibee PH","724fbdf9-33d2-461d-8b00-3765780a4f88","JOLLIBEE Danao","LEVEL 1 GAISANO CAPITAL DANAO RALOTA STREET LOOC","Danao","Cebu","6004","PH","10.519194673","124.026487707","639613093003"
"Jollibee PH","a8ed28ab-a660-4ca1-9939-432689a7a5bb","JOLLIBEE Danao Sands DT","CENTRAL NAUTICAL HIGHWAY POBLACION","Danao","Cebu","6004","PH","10.520976918","124.029595039","639989636780"
"Jollibee PH","76b8133d-3002-43e3-bbfc-8815ae56e1cd","JOLLIBEE Daraga","RIZAL STREET BAGUMBAYAN","Daraga","Albay","4501","PH","13.148897","123.714365","639291437302"
"Jollibee PH","26aeacf7-931d-498f-8f5c-a41c8a531ce9","JOLLIBEE Dasmarinas Bayan","DON P. CAMPOS AVENUE ZONE IV (POB.)","Dasmarinas","Cavite","4114","PH","14.32626","120.936284","639284330049"
"Jollibee PH","010e3d82-13bf-4f5e-ba01-8fe5b3d00b21","JOLLIBEE Dasmarinas Central Mall","LEVEL 1 CENTRAL MALL SALITRAN E. AGUINALDO HIGHWAY SALITRAN II","Dasmarinas","Cavite","4114","PH","14.3502","120.93789","639398030713"
"Jollibee PH","65959b2d-17a7-47e3-8d94-7e021b6b25f6","JOLLIBEE Dasmarinas DBB","C TRINIDAD AVENUE BUROL I","Dasmarinas","Cavite","4115","PH","14.33448","120.953978","639669350073"
"Jollibee PH","afb31fe0-912c-4406-8bab-202ed0482fdc","JOLLIBEE Dasmarinas Paliparan","PALIPARAN MOLINO ROAD PALIPARAN III","Dasmarinas","Cavite","4114","PH","14.320558","120.985045","639657124931"
"Jollibee PH","fcf02066-4918-4e7f-af13-37c0367cfbe3","JOLLIBEE Dau","MACARTHUR HIGHWAY LAKANDULA","Mabalacat","Pampanga","2010","PH","15.178507","120.587231","639188236135"
"Jollibee PH","d3da0e4d-3e9e-4510-bb96-ec90715097e9","JOLLIBEE Dau Bus","DAU EXPRESSWAY EXTENSION LAKANDULA","Mabalacat","Pampanga","2010","PH","15.178756","120.589044","639188236116"
"Jollibee PH","1ae6dbea-44e9-4cb0-8150-e58414f42d7d","JOLLIBEE Dau McArthur","MCARTHUR HIGHWAY POLICARPIO TRUCKING COMPOUND, DAU","Mabalacat","Pampanga","2010","PH","15.175591963","120.587472729","639946156089"
"Jollibee PH","78566f32-cf37-42a5-a93e-1c41f2fb0917","JOLLIBEE Davao Agdao","ESTER BLDG LAPU LAPU STREET GOV. VICENTE DUTERTE","Davao City","Davao Region","8000","PH","7.08239","125.623189","639455410627"
"Jollibee PH","8b0ec6d7-0619-4ec4-8a1b-f15f343839ef","JOLLIBEE Davao Bolton","BOLTON STREET CORNER J.P. RIZAL STREET BARANGAY 12-B (POB.)","Davao City","Davao Region","8000","PH","7.066192","125.609328","639239285948"
"Jollibee PH","73b1d895-d857-473d-be53-68a514c46177","JOLLIBEE Davao Circumferential Road","CIRCUMFERENTIAL RD BARANGAY 19-B (POB.)","Davao City","Davao Region","8000","PH","7.084575791","125.605931219","639171352655"
"Jollibee PH","defa711e-e6eb-4b03-b234-66d9dbb3da35","JOLLIBEE Davao DMC Drive-Thru","J.P. LAUREL AVENUE RAFAEL CASTILLO","Davao City","Davao Region","8000","PH","7.097051","125.619434","639688658667"
"Jollibee PH","974e86b7-b4b8-40c5-8fa0-814839e126e9","JOLLIBEE Davao Gaisano Mall","UPPER GROUND GAISANO MALL OF DAVAO J.P. LAUREL AVENUE WILFREDO AQUINO","Davao City","Davao Region","8000","PH","7.078183","125.613422","639107770982"
"Jollibee PH","062a8e0d-2226-4113-b6e0-20ba666bdf97","JOLLIBEE Davao Lanang","J.P. LAUREL AVENUE SASA","Davao City","Davao Region","8000","PH","7.109747","125.649098","639062314644"
"Jollibee PH","27fb4050-f429-41ff-963d-15a0652f2306","JOLLIBEE Davao Maa Drive-Thru","DON J. RODRIGUEZ SR. AVENUE MA-A","Davao City","Davao Region","8000","PH","7.080347","125.582682","639189075808"
"Jollibee PH","54befa3b-d97d-4a17-8131-559204b67197","JOLLIBEE Davao Matina","MACARTHUR HIGHWAY MATINA CROSSING","Davao City","Zamboanga Peninsula","8021","PH","7.058906","125.56908","639636507884"
"Jollibee PH","3a70c2fd-3a77-45a8-9f37-4583d3361a6e","JOLLIBEE Davao MTS DT","MACARTHUR HIGHWAY MATINA CROSSING","Davao City","Davao Region","8000","PH","7.062918","125.596835","639209087728"
"Jollibee PH","a037d4d8-a2a0-4110-8bae-336bfb7ecc66","JOLLIBEE Davao Quimpo DT","QUIMPO BOULEVARD MATINA APLAYA","Davao City","Davao Region","8000","PH","7.057391","125.600747","639189384146"
"Jollibee PH","b76c83b8-13cd-4101-b72b-25fc9aee0355","JOLLIBEE Davao Sto. Nio","DAVAO BUKIDNON HIGHWAY SANTO NINO","Davao City","Davao Region","8000","PH","7.080427","125.512574","639538319771"
"Jollibee PH","4841a78c-66da-41fd-ae6c-7a37b9f9f635","JOLLIBEE Davao Talomo Highway DT","MCARTHUR HIGHWAY BAGANIHAN","Davao City","Davao Region","8000","PH","7.05971","125.550288","639776574476"
"Jollibee PH","4b9a2e9d-ee85-4e87-87bb-33651916072a","JOLLIBEE Davao Times Square","LEVEL 1 TIMES SQUARE DUTERTE STREET CORNER ILLUSTRE STREET BARANGAY 11-B (POB.)","Davao City","Davao Region","8000","PH","7.069086","125.605774","639225014740"
"Jollibee PH","823901ae-58b9-43d1-bcce-4da39449896f","JOLLIBEE Davao Toril","AGTON STREET TORIL (POB.)","Davao City","Zamboanga Peninsula","8025","PH","7.016569","125.497893","639688783658"
"Jollibee PH","550d105b-35f6-4ba9-9a5b-a49d616d97d4","JOLLIBEE Deca Mall","LEVEL 1 DECA MALL TONDO VITAS STREET BARANGAY 99","Manila","Metro Manila","1013","PH","14.624757","120.963236","639190062325"
"Jollibee PH","db33fad7-5872-43b6-954d-e0855e3e33e4","JOLLIBEE Deparo Bagumbong","BAGUMBONG RD BARANGAY 171","Caloocan","Metro Manila","1421","PH","14.752408","121.016992","639190023052"
"Jollibee PH","65cc2afe-bc1f-4190-b8ce-d7872e8ea65a","JOLLIBEE Digos City Hall","LIM STREET ZONE 3 (POB.)","Digos","Davao del Sur","8002","PH","6.743172","125.355397","639304468782"
"Jollibee PH","23d3f169-4788-4680-9ec8-dac3e94fc50d","JOLLIBEE Digos DT (Quezon Ave )","QUEZON AVENUE ZONE 3 (POB.)","Digos","Davao del Sur","8002","PH","6.756421","125.354285","639207204130"
"Jollibee PH","d393fa68-69c4-4020-afa9-c876f5ff0978","JOLLIBEE Dinalupihan","GAPAN OLONGAPO ROAD BONIFACIO (POB.)","Dinalupihan","Bataan","2110","PH","14.867032","120.465552","639985515036"
"Jollibee PH","029b2681-1392-402c-bb1a-38a3039148aa","JOLLIBEE Dipolog Quezon","QUEZON AVENUE MIPUTAK (POB.)","Miputak","Zamboanga del Norte","7100","PH","8.58181","123.338796","639633689594"
"Jollibee PH","b6c2f2a8-7b2d-4a63-af15-b47e73658c45","JOLLIBEE Diversion Rd. Batangas","DIVERSION ROAD BALAGTAS","Batangas City","Batangas","4200","PH","13.789223","121.060893","639952710039"
"Jollibee PH","e9166b85-b019-4f32-95fd-158a166babcf","JOLLIBEE Dolores Junction","OLONGAPO GAPAN ROAD DOLORES","San Fernando","Pampanga","2000","PH","15.039265","120.681682","639189301221"
"Jollibee PH","a94d420d-a49b-41d1-8f22-d620bf3a32e7","JOLLIBEE Dolores Mc Arthur","MACARTHUR HIGHWAY PAMPANGA DEVT BANK, DOLORES","San Fernando","Pampanga","2000","PH","15.034566","120.685726","639185988356"
"Jollibee PH","d241e13a-1aee-44c9-909f-a7e90560a1cf","JOLLIBEE DOMESTIC ROAD","SALEM INTERNATIONAL COMMERCIAL COMPLEX DOMESTIC ROAD BARANGAY 191","Pasay","Metro Manila","1301","PH","14.522766","121.000561","639479972306"
"Jollibee PH","f482a26d-0682-4f8d-bb0a-f09f627289bf","JOLLIBEE Don Antonio","HOLY SPIRIT DRIVE CORNER DON FAUSTINO STREET HOLY SPIRIT","Quezon City","Metro Manila","1127","PH","14.683492","121.077711","639171354624"
"Jollibee PH","c6f0c75f-39f0-4852-9777-4f066213ef6a","JOLLIBEE Dragon 8","LEVEL 3 DRAGON 8 SHOPPING CENTER DAGUPAN STREET CORNER CM RECTO AVENUE BARANGAY 10","Manila","Metro Manila","1012","PH","14.606527","120.970671","639959186792"
"Jollibee PH","15d84d7c-cb6a-4622-8086-f22b21262af4","JOLLIBEE D.Tuazon","D. TUAZON STREET CORNER QUEZON AVENUE LOURDES","Quezon City","Metro Manila","1114","PH","14.620171","121.00389","639670759069"
"Jollibee PH","f136a3cb-d7d7-4d8e-8eb4-b7c872ef5388","JOLLIBEE Dumaguete 2","NATIONAL HIGHWAY DARO","Dumaguete","Negros Oriental","6200","PH","9.311557","123.304815","639399128782"
"Jollibee PH","cf475e7c-cedd-4937-a815-18987542dad9","JOLLIBEE Dumaguete Cathedral","GOVERNOR PERCIDES STREET POBLACION NO. 5 (BARANGAY 5)","Dumaguete","Negros Oriental","6200","PH","9.306029","123.307625","639285188149"
"Jollibee PH","24129c49-35e9-49d1-9bbe-5a184bb11099","JOLLIBEE Dumaguete Perdices","PERDICES STREET CORNER SAN JOSE STREET LOOC","Dumaguete","Negros Oriental","6200","PH","9.308209","123.307524","639189114125"
"Jollibee PH","7b48861e-e870-420d-a1b8-756e49411cca","JOLLIBEE Dumaguete South Road","SOUTHROAD DUMAGUETE HIGHWAY BUNAO","Dumaguete","Negros Oriental","6200","PH","9.299042","123.302462","639684059670"
"Jollibee PH","ec921054-9192-4d6c-bbb3-c2a711e28990","JOLLIBEE East Avenue","PMHA COMMERCIAL BUILDING EAST AVENUE CORNER V. LUNA AVENUE PINYAHAN","Quezon City","Metro Manila","1100","PH","14.637753","121.046349","639154966852"
"Jollibee PH","2adc744d-e15f-41fb-ac64-8a480fec24d8","JOLLIBEE Ecowest Drive DT","ABS CBN QUIMPO BLVD DIVERSION RD MATINA APLAYA","Davao City","Davao Region","8000","PH","7.049784","125.585076","639460631792"
"Jollibee PH","a917749e-ce34-4199-9a69-23da8c7ac892","JOLLIBEE EDSA Arayat","RAY LOR BUILDING ARAYAT STREET SAN MARTIN DE PORRES","Quezon City","Metro Manila","1111","PH","14.619371","121.050609","639179071434"
"Jollibee PH","d1a4061c-a4f0-4c57-9fe3-713db4a9e063","JOLLIBEE EDSA GUEVARRA","UPPER GROUND  EDSA CORNER D GUEVARA STREET HIGHWAY HILLS","Mandaluyong","Metro Manila","1550","PH","14.578811","121.051505","639955723369"
"Jollibee PH","8b4c3ce9-e1e3-4242-b1fd-eb0faec394f4","JOLLIBEE Edsa Maya","MAYA ARCADE EDSA E. RODRIGUEZ","Quezon City","Metro Manila","1111","PH","14.623996","121.049421","639103987347"
"Jollibee PH","c2b44396-9ef1-4bb5-8501-967694021e57","JOLLIBEE EDSA Philtranco","EDSA CORNER A. CRUZ STREET BARANGAY 119","Pasay","Metro Manila","1303","PH","14.537645412","121.004139532","639051548638"
"Jollibee PH","7d1d8eda-51c5-45db-ac43-911c1eb8e266","JOLLIBEE EDSA Revilla Pasay","LEVEL 1 RED HOTEL DON C REVILLA STREET CORNER EDSA BARANGAY 147","Pasay","Metro Manila","1303","PH","14.537353","121.001712","639204421496"
"Jollibee PH","c9516441-b877-4372-ba85-c24c1b93815b","JOLLIBEE EDSA ZAMORA","ACOSTA BLDG EDSA BARANGAY 98","Pasay","Metro Manila","1303","PH","14.537914","121.001606","639627332871"
"Jollibee PH","6eea2b09-3ce0-4ed1-bca2-9c85d3294864","JOLLIBEE E Lopez","E. LOPEZ STREET CORNER JALANDONI STREET OUR LADY OF LOURDES","Iloilo City","Bicol","5000","PH","10.718997","122.560779","639989871924"
"Jollibee PH","3608a279-2d87-4c0e-b1d6-ef0e028cb3fc","JOLLIBEE El Salvador","NATIONAL HIGHWAY POBLACION, POBLACION","Sinaloc","Misamis Oriental","9018","PH","8.562034","124.523892","639177906446"
"Jollibee PH","4be913fd-dd2e-4167-af11-abe628307dd1","JOLLIBEE EMA TOWN CENTER","EL CAMINO REAL STREET CAMALIG","Meycauayan","Bulacan","3020","PH","14.765612","120.991787","639088795530"
"Jollibee PH","fcf8e46b-5982-401f-9372-b71d80b7933b","JOLLIBEE Enrile Boulevard","ENRILE AVE. CARIG","Tuguegarao","Cagayan","3500","PH","17.650005","121.752709","639625202376"
"Jollibee PH","10776e90-5c0d-4bdf-bfe4-65d00fcf886b","JOLLIBEE EPZA Rosario","GENERAL TRIAS DRIVE KM 30, TEJEROS CONVENTION","Rosario","Cavite","4106","PH","14.40675","120.859265","639672396886"
"Jollibee PH","2afb14a3-4b34-463a-b7c7-7c2563bfa0ef","JOLLIBEE E.Rodriguez Drive Thru","E. RODRIGUEZ SR. AVENUE CORNER STA. CECILLA STREET DAMAYANG LAGI","Quezon City","Metro Manila","1112","PH","14.620751","121.021731","639688928676"
"Jollibee PH","8b22031d-acea-4df8-8c67-1ed4ff007ab7","JOLLIBEE Escario DT","N. ESCARIO STREET CAPITOL SITE (POB.)","Cebu City","Central Visayas","6000","PH","10.317222","123.894237","639617557885"
"Jollibee PH","f09cbd4a-36ba-4557-af34-20974bdc05fb","JOLLIBEE ESPANA DON QUIJOTE","D QUIJOTE STREET BARANGAY 465","Manila","Metro Manila","1008","PH","14.610935","120.993922","639687116224"
"Jollibee PH","fde6189d-0786-408d-b323-582149580141","JOLLIBEE Eton Centris","LEVEL 1 ETON CENTRIS STATION EDSA CORNER QUEZON AVENUE PINYAHAN","Quezon City","Davao Region","7876","PH","14.643508","121.038516","639686252660"
"Jollibee PH","732a2c8f-5bc5-45d1-8f19-7d5ac5bd49a1","JOLLIBEE Eton City Sta. Rosa","GREENFIELD PARKWAY MALITLIT","Santa Rosa","Laguna","4026","PH","14.259293","121.091409","639928332816"
"Jollibee PH","b61b4b81-a827-4849-938d-f2deee1246aa","JOLLIBEE EVACOM","LEVEL 1 LIANAS SUPERMARKET DR. A. SANTOS AVENUE CORNER CANAYNAY AVENUE SAN DIONISIO","Paranaque","Metro Manila","1700","PH","14.47517","121.00084","639350780357"
"Jollibee PH","22febd07-c9b0-4178-bb97-e533b3d96527","JOLLIBEE EVANGELISTA","EDSA CORNER EVANGELISTA STREET BANGKAL","Makati","Metro Manila","1233","PH","14.539296","121.012185","639998804598"
"Jollibee PH","6a952742-2754-4361-9f09-53a46b2a7bc7","JOLLIBEE Ever Gotesco DMMA 1","LOWER GROUND EVER GOTESCO COMMONWEALTH COMMONWEALTH AVENUE BATASAN HILLS","Quezon City","Metro Manila","1126","PH","14.678324","121.084492","639382477337"
"Jollibee PH","b0e70c78-afa3-4cf6-b51c-5de783bd9e1e","JOLLIBEE Fairview Regalado","COMMONWEALTH AVENUE CORNER REGALADO STREET FAIRVIEW","Quezon City","Metro Manila","1122","PH","14.70623","121.069821","639176272701"
"Jollibee PH","9d89d7b4-be6f-4644-89db-c8c9843cd096","JOLLIBEE Fairview Terraces","LOWER GROUND FAIRVIEW TERRACES QUIRINO HIGHWAY CORNER MALIGAYA STREET PASONG PUTIK PROPER (PASONG PUTIK)","Quezon City","Metro Manila","1118","PH","14.737245","121.059392","639163736206"
"Jollibee PH","f30c3644-3dc8-400d-b940-777390124bbc","JOLLIBEE Farmer's Market","LEVEL 1 FARMERS MARKET GENERAL ARANETA STREET CORNER CENTRAL AVENUE SOCORRO","Quezon City","Metro Manila","1109","PH","14.619463","121.052847","639279366986"
"Jollibee PH","2a425ac2-8399-46e8-b482-231c79c1a598","JOLLIBEE FASTBYTES","FASTBYTES NORTHGATE AVENUE CORNER NORTH BRIDGEWAY STREET ALABANG","Muntinlupa","Metro Manila","1789","PH","14.425089","121.039724","639989852157"
"Jollibee PH","86ee9718-5b20-462c-a7b4-d57776f4178a","JOLLIBEE F.Cabahug","F. CABAHUG STREET MABOLO","Cebu City","Central Visayas","6000","PH","10.32536","123.91884","639321882361"
"Jollibee PH","2b8023d7-29c7-432c-b72e-83d095eb9281","JOLLIBEE FCIE Dasmarinas","GOVERNORS DRIVE LANGKAAN II","Dasmarinas","Cavite","4126","PH","14.292362","120.93208","639209733432"
"Jollibee PH","e802885e-a70c-4489-bbd1-9d223632c158","JOLLIBEE Festive Walk","LEVEL 1 FESTIVE WALK MALL MEGAWORLD BOULEVARD ABETO MIRASOL TAFT SOUTH (QUIRINO ABETO)","Iloilo City","Bicol","5000","PH","10.716517","122.546017","639190921437"
"Jollibee PH","ab4052fa-4d54-42f9-afb0-a35cd7cffa44","JOLLIBEE Fiesta World Lipa","LEVEL 1 FIESTA WORLD BUILDING A NATIONAL ROAD MARAUOY","Lipa","Batangas","4217","PH","13.961604","121.168992","639985798918"
"Jollibee PH","0ce08d6c-a768-44f2-b608-83ecdfcb2eb4","JOLLIBEE Fishermall Malabon","LEVEL 1 FISHER MALL MALABON C4 ROAD LONGOS","Malabon","Metro Manila","1411","PH","14.656713","120.961146","639052134439"
"Jollibee PH","b5a58fff-c832-493c-9e2a-1831de9d7d01","JOLLIBEE FIVE-ECOM CENTER","LEVEL 1 FIVE E COM CENTER HARBOR DRIVE CORNER PALM COAST AVENUE BARANGAY 72","Pasay","Metro Manila","1308","PH","14.538817","120.982212","639615280870"
"Jollibee PH","a4f56893-5a84-4cf7-bf61-aeb119d644d7","JOLLIBEE F. Llamas","F. LLAMAS STREET PUNTA PRINCESA","Cebu City","Central Visayas","6000","PH","10.295382","123.869605","639393789375"
"Jollibee PH","2d4fb9c5-527f-4595-89d4-b3208162085b","JOLLIBEE Floridablanca","MACABULOS STREET POBLACION","Floridablanca","Pampanga","2006","PH","14.973945","120.528986","639999353421"
"Jollibee PH","b55c2749-fdff-4593-8c7f-182696c43d0e","JOLLIBEE F. Manalo","BLUMENTRITT STREET CORNER MANALO STREET KABAYANAN","2nd District","Metro Manila","1500","PH","14.59594","121.028303","639701176136"
"Jollibee PH","2270c2cd-30bc-43c4-9848-755ca4d0a0e3","JOLLIBEE FRIENDSHIP","FIL AM FRIENDSHIP HIGHWAY CORNER RIZAL STREET CUTCUT","Angeles","CALABARZON","2009","PH","15.129451317","120.574810867","639199143354"
"Jollibee PH","d7e47fcc-6c81-48cb-9543-7e087abaffb8","JOLLIBEE FTI Sunshine Mall","LEVEL 1 SUNSHINE PLAZA MALL DBP AVENUE WESTERN BICUTAN","Taguig","Metro Manila","1713","PH","14.50535","121.041097","639517794881"
"Jollibee PH","43982f27-80d4-4f2f-9b78-f01b515cb0b5","JOLLIBEE Gagalangin","J. LUNA STREET CORNER PAMPANGA STREET BARANGAY 173","Manila","Metro Manila","1013","PH","14.628798","120.974084","639193021481"
"Jollibee PH","00c88997-9e9f-4d71-895c-966c4db21666","JOLLIBEE Gaisano Butuan","LEVEL 1 GAISANO MALL BUTUAN JC AQUINO AVENUE CORNER CAPITOL AVENUE BONBON","Butuan","Caraga","8600","PH","8.944171","125.532074","639285166782"
"Jollibee PH","ac1fc15e-1aad-4c0a-9cdc-9a7da33ae062","JOLLIBEE Gaisano Grand City Gate Davao","UPPER GROUND GAISANO GRAND CITY GATE DAVAO BUHANGIN ROAD BARANGAY 24-C (POB.)","Davao City","Davao Region","8000","PH","7.110453","125.612504","639684178122"
"Jollibee PH","424b30d8-0c07-475b-b551-1a61efcf019d","JOLLIBEE Gaisano Grand Mactan","LEVEL 1 GAISANO GRAND MACTAN M.V. PATALINGHUG JR. AVENUE CORNER BASAK SISI AGUS ROAD BASAK","Lapu-Lapu","Central Visayas","6016","PH","10.285834","123.969491","639285127591"
"Jollibee PH","b514d1e7-5dd1-4348-b3ad-5fc1af71bd7e","JOLLIBEE Gaisano Grandmall Panabo","LEVEL 1 GAISANO GRAND PANABO QUEZON STREET SANTO NINO (POB.)","Panabo","Davao del Norte","8105","PH","7.306387","125.686493","639189033501"
"Jollibee PH","8abe01d7-6ce3-41b0-b89d-9b81cf855533","JOLLIBEE Gaisano Grand Mall Talomo","MCARTHUR HIGHWAY TALOMO (POB.)","Davao City","Zamboanga Peninsula","8023","PH","7.051284958","125.542151423","639150576571"
"Jollibee PH","f984fcfd-928a-481c-9040-a4f910399914","JOLLIBEE Gaisano Grandmall Toril","LOWER GROUND GAISANO GRAND TORIL NATIONAL HIGHWAY TORIL (POB.)","Davao City","Zamboanga Peninsula","8025","PH","7.0135522","125.4908238","639189478752"
"Jollibee PH","27420ada-dffb-4efa-b3c3-bc2ab13a1edf","JOLLIBEE Gaisano Grand Tibungco","NATIONAL HIGHWAY KM 18, TIBUNGCO","Davao City","Davao Region","8000","PH","7.196567839","125.647356771","639397683619"
"Jollibee PH","bcc6a856-fc2b-4f8d-be6a-b49f1e76cb45","JOLLIBEE Gaisano Iligan","LEVEL 1 GAISANO CITY MALL ILIGAN ROXAS AVENUE VILLA VERDE","Iligan","Northern Mindanao","9200","PH","8.230576","124.241267","639688546755"
"Jollibee PH","2b2b2b6a-4593-4b7e-af9b-7fcd44f17056","JOLLIBEE Gaisano Mall Toril","UPPER GROUND GAISANO GRAND TORIL NATIONAL HIGHWAY TORIL (POB.)","Davao City","Zamboanga Peninsula","8025","PH","7.016611572","125.493899158","639189079651"
"Jollibee PH","41ce1607-865c-476e-a169-4ec100fd0ea9","JOLLIBEE Gaisano Pagadian","UPPER GROUND GAISANO CAPITAL PAGADIAN J.P. RIZAL AVENUE SAN PEDRO (POB.)","Pagadian","Zamboanga del Sur","7016","PH","7.824219","123.441228","639703668907"
"Jollibee PH","d77d883c-696d-4ff3-9ae0-ddbf1fafbc43","JOLLIBEE Gaisano Roxas Marketplace","LEVEL 1 GAISANO GRAND MARKETPLACE SAN ROQUE EXTENSION POBLACION IV (BARANGAY IV)","Roxas","Capiz","5800","PH","11.579243","122.756559","639082398661"
"Jollibee PH","2b42a9fa-0df6-4394-a73e-6e90560483b3","JOLLIBEE Gapan","GENERAL TINIO STREET CORNER JACINTO STREET SAN VICENTE (POB.)","Gapan","Nueva Ecija","3105","PH","15.312347","120.94904","639189446144"
"Jollibee PH","d063e513-c0b5-4a43-8f88-5bc284bfcb81","JOLLIBEE GATE 3 PLAZA","LAWTON STREET CORNER C. ROCES AVENUE WESTERN BICUTAN","Taguig","Metro Manila","1222","PH","14.52554","121.027473","639774442897"
"Jollibee PH","e2a8a3a0-4ed2-4bb6-ad2b-0274e556bb5e","JOLLIBEE Gatuslao-Burgos Bacolod DT","GATUSLAO STREET CORNER BURGOS STREET BARANGAY 9 (POB.)","Bacolod","Negros Occidental","6100","PH","10.672367","122.948956","639185746542"
"Jollibee PH","5566ad3a-b9a9-41ef-b8fe-9c72cd2d5b0e","JOLLIBEE General Maxilom DT","GENERAL MAXILOM AVENUE CORNER JAKOSALEM STREET ZAPATERA","Cebu City","Central Visayas","6000","PH","10.311163","123.899535","639616633953"
