Retailer,StoreID,StoreName,StoreAddress,StoreCity,StoreState,Zipcode,Country,Latitude,Longitude,Phone
"Jollibee FoodPanda","138936","Jollibee - SM City Roxas","SM City Roxas Arnaldo Boulevard Barangay Baybay 1st District (7Q34HPWX+C9)","Roxas","CAP","5800","PH","11.59529415","122.74816265","+639494799264"
"Jollibee FoodPanda","74827","Jollibee - SM Marilao","SM City Marilao Building Mc Arthur Highway Barangay Ibayo 1st District","Marilao","BUL","3019","PH","14.75343495","120.95583427","+639683606513"
"Jollibee FoodPanda","55323","Jollibee - SM Rosario","Ground Floor SM Rosario General Trias Drive coner Costa Verde Access Road 1st District","Rosario","CAV","4106","PH","14.40965995","120.8576974","+639293359363"
"Jollibee FoodPanda","44170","Jollibee - SM Sta. Rosa","Ground Floor SM Santa Rosa Barangay Tagapo 1st District","Santa Rosa","LAG","4026","PH","14.31300975","121.09913635","+632495301534"
"Jollibee FoodPanda","55175","Jollibee - SM Dasmarinas 1","Upper Ground Floor SM City Dasmarinas Governors Drive Sampaloc 1 Pala Pala 4th District","Dasmarinas","CAV","4114","PH","14.30127255","120.95641645","+639463100052"
"Jollibee FoodPanda","77197","Jollibee - Catbalogan","Allen Avenue Barangay Poblacion 2nd District","Catbalogan","SAM","6700","PH","11.77647708","124.88283674","+639171659142"
"Jollibee FoodPanda","74295","Jollibee - Calumpang","Pan Phil Highway corner Tayabas Sariaya Road Barangay Calumpang 1st District","Tayabas","QUE","4327","PH","13.9755068","121.55702025","+639617452998"
"Jollibee FoodPanda","48865","Jollibee - SM Calamba","Ground floor SM City Calamba Barangay Real 2nd District","Calamba","LAG","4027","PH","14.20371855","121.1548259","+639615827195"
"Jollibee FoodPanda","55320","Jollibee - SM Tarlac","Upper Ground Floor SM City Tarlac McArthur Highway 1st District","Tarlac City","TAR","2300","PH","15.47670385","120.5949211","+639633228269"
"Jollibee FoodPanda","32402","Jollibee - SM BF Homes Paranaque","Third Floor SM City BF Homes Paranaque Dr A Santos Avenue Corner Presidents Avenue Barangay BF Homes 1st District","Paranaque","MET","1700","PH","14.45787615","121.0325833","+639270711963"
"Jollibee FoodPanda","39099","Jollibee - Robinsons Valencia","Robinsons Valencia 1st District","Valencia","BUK","8709","PH","7.93496285","125.1003002","+639650945871"
"Jollibee FoodPanda","44168","Jollibee - Robinsons Galleria South","Level 1 Robinsons Galleria South 179 Manila South Road Barangay Nueva 1st District","San Pedro","LAG","4023","PH","14.35210575","121.06174455","+639088970970"
"Jollibee FoodPanda","39195","Jollibee - SM Center Dagupan","SM Center Dagupan L1 MH Del Pilar Street Barangay Herrero-Perez 1st District","Dagupan","PAN","2400","PH","16.0444835","120.34329375","+639166901872"
"Jollibee FoodPanda","28307","Jollibee - SM Sta Mesa","Aurora Boulevard corner Araneta Avenue Extension Sta Mesa 6th District (7Q63J239+XH)","Manila","MET","1000","PH","14.60465475","121.0187693","+63287093391"
"Jollibee FoodPanda","28755","Jollibee - SMEO","SM City East Ortigas Level 1 Ortigas Extension Barangay Sta Lucia 1st District","Pasig","MET","1600","PH","14.5870543","121.10420785","+63287212165"
"Jollibee FoodPanda","48717","Jollibee - Robinson Gen Trias","Level 1 Robinsons General Trias EPZA-Bacao A. Soriano Highway Diversion Road 6th District","General Trias","CAV","4107","PH","14.3962263","120.86513045","+63464372729"
"Jollibee FoodPanda","48712","Jollibee - SM Taytay","Upper Ground Floor Building B SM City Taytay Diversion Road Dolores 1st District","Taytay","RIZ","1870","PH","14.5649581","121.13940815","+63282864606"
"Jollibee FoodPanda","44040","Jollibee - Fairview Terraces","Lower Ground Floor Ayala Fairview Terraces Maligaya Road Corner Quirino Highway Novaliches 1st District","Quezon","QUE","1100","PH","14.7372078","121.0595043","+63279568948"
"Jollibee FoodPanda","39221","Jollibee - SM Olongapo Central","Level 1 SM Olongapo Central Rizal Avenue Barangay East Tapinac 1st District","Olongapo","ZAM","2200","PH","14.83686505","120.2830085","+639503659692"
"Jollibee FoodPanda","28677","Jollibee - SM Muntinlupa","Ground Floor Atrium Area SM City Muntinlupa Manila S Road Tunasan 1st District","Muntinlupa","MET","1773","PH","14.3774776","121.04590745","+63286591740"
"Jollibee FoodPanda","32289","Jollibee - SM Cherry","145 Marikinainfanta Highway Barangay Padilla 1st District","Antipolo","RIZ","1870","PH","14.62491325","121.13381555","+63286363594"
"Jollibee FoodPanda","159277","Jollibee - SM Jmall","Upper Ground Floor SM Jmall Barangay Bakilid Mandaue City Cebu 1st District7Q258WPM+3H","Mandaue City","CEB","6014","PH","10.3360119","123.9348564","+639563569122"
"Jollibee FoodPanda","31627","Jollibee - SM Valenzuela","Level 1 SM City Valenzuela Barangay Karuhatan 1st District","Valenzuela","MET","1470","PH","14.686218","120.9764404","+63282851788"
"Jollibee FoodPanda","34250","Jollibee - New SM Southmall","Basement level SM Southmall Alabang Zapote Road Barangay Talon Tres 2nd District","Las Pinas","MET","1740","PH","14.43376825","121.01087075","+63288054585"
"Jollibee FoodPanda","35474","Jollibee - SM City Iloilo","SM City, Benigno Aquino Jr. Ave, Brgy.Boliliao, Mandurriao, Iloilo City, 5000 Iloilo","Iloilo City","ILO","5000","PH","10.7133532","122.55126875","+63333209731"
"Jollibee FoodPanda","32542","Jollibee - Marquee Mall","Marquee Mall Pulung Maragul Barangay Balibago 1st District","Angeles","PAM","2009","PH","15.16314185","120.60930545","+639694625207"
"Jollibee FoodPanda","97978","Jollibee - Vista Mall Bataan","Ground Floor Vista Mall Bataan Roman Super Highway Cupang Proper 1st District","Balanga","BAT","2100","PH","14.65483815","120.533849","+639289453034"
"Jollibee FoodPanda","50260","Jollibee - SM SJDM","Upper Ground SM City San Jose Del Monte Ciudad Real San Jose Del Monte City Bulacan 1st District","San Jose Del Monte","BUL","3017","PH","14.785989","121.0753905","+639224963795"
"Jollibee FoodPanda","34262","Jollibee - SM Aura","Ground Floor SM Aura Premier 26th Street McKinley Parkway Barangay Fort Bonifacio 2nd District","Taguig","MET","1630","PH","14.5462032","121.0541823","+63288163503"
"Jollibee FoodPanda","32640","Jollibee - Robinsons Las Pinas","Ground Floor Robinsons Place Las Pinastalon Uno Albang Zapote Road 1st District","Las Pinas","MET","1740","PH","14.44277784","120.99871104","+63288939291"
"Jollibee FoodPanda","15522","Jollibee - San Juan Batangas","Poblacion San Juan","San Juan","BAT","4200","PH","13.8255054","121.39273235","+639151231145"
"Jollibee FoodPanda","75360","Jollibee - Robinsons Starmills","Ground Floor Robinsons Starmills Barangay San Jose 3rd District","San Fernando","PAM","2000","PH","15.04955515","120.69777565","+639272517673"
"Jollibee FoodPanda","74444","Jollibee - Sta. Lucia Grand Mall","Building 3 Santa Lucia Grand Mall Marcos Highway Corner Felix Avenue Barangay San Isidro 1st District","Cainta","RIZ","1900","PH","14.617864","121.1000451","+63286815132"
"Jollibee FoodPanda","115697","Jollibee - Mall of Asia 1","Level 1 SM Mall of Asia Main Pacific Drive Barangay 76 4th District (7Q62GXPJ+6R)","Pasay","MET","1300","PH","14.5347187","120.98281655","+63283615388"
"Jollibee FoodPanda","81877","Jollibee - SM Pulilan","SM City Pulilan Plaridel Pulilan Road DRT Highway Santo Cristo 1st District","Pulilan","BUL","3005","PH","14.8986249","120.8701674","+639436011522"
"Jollibee FoodPanda","145642","Jollibee - Robinsons Gapan","Robinsons Gapan Pan-Philippine Highway Brgy Bayanihan Gapan 4th District (8W2X+87C Gapan City, Nueva Ecija)","Gapan","NEC","3105","PH","15.3004797","120.9480008","+639650945871"
"Jollibee FoodPanda","150500","Jollibee - SM City Caloocan","Ground Level SM City Caloocan Deparo Road Barangay 171 Zone 15 1st District","Caloocan","MET","1400","PH","14.751324","121.0198103","+639082215539"
"Jollibee FoodPanda","28322","Jollibee - Robinsons Magnolia","Robinsons Magnolia Aurora Boulevard corner Hemady Street Brgy Mariana","Quezon","QUE","1000","PH","14.61520105","121.0382909","+63276254131"
"Jollibee FoodPanda","34123","Jollibee - SM Marikina","Ground Floor SM Marikina Marikina to Infanta Highway Barangay Kalumpang 1st District","Marikina","MET","1800","PH","14.62596651","121.08418941","+63284771799"
"Jollibee FoodPanda","34190","Jollibee - Glorietta","Second Floor, Glorietta 4, Ayala CenterBrgy. San Lorenzo, Makati City1223","Makati","MET","1200","PH","14.55127965","121.025848","+63285512486"
"Jollibee FoodPanda","46434","Jollibee - SM City Fairview","Upper Ground Floor Centralwalk SM City Fairview Fairview Quezon City 1st District","Quezon","QUE","1100","PH","14.7346369","121.0587585","+63289359117"
"Jollibee FoodPanda","100728","Jollibee - SM City Grand Central","Level 2 SM City Grand Central Rizal Extension Barangay 88 2nd District","Caloocan","MET","1403","PH","14.6548386","120.98427005","+63286721833"
"Jollibee FoodPanda","46432","Jollibee - SM City Novaliches","Ground Floor Jollibee SM City Novaliches Barangay San Bartolome Quirino Highway 1st District","Quezon","QUE","1100","PH","14.7082051","121.03804945","+63284426016"
"Jollibee FoodPanda","39200","Jollibee - Robinsons Ormoc","Level 1 Robinsons Place Ormoc Palo - Carigara - Ormoc City Road Purok Chrysanthemum Barangay Cogon 4th District","Ormoc","LEY","6541","PH","11.02527435","124.60486005","+639275516452"
"Jollibee FoodPanda","19200","Jollibee - Bacolod Gaisano","G/F, Gaisano City Bacolod, Araneta St., Singcang","Bacolod City","NOC","9200","PH","10.658764","122.939359","+639661778591"
"Jollibee FoodPanda","32459","Jollibee - Bacolod Robinsons","Ground Floor Robinsons Place Bacolod Mandalagan 1st District","Bacolod City","NOC","6100","PH","10.6913371","122.9586285","+639213593209"
"Jollibee FoodPanda","19178","Jollibee - Ilagan","8 Ilagan Shopmart Plaza, National Highway, Baligatan, Ilagan","Isabela","BAS","3300","PH","17.127761","121.866231","+639772780573"
"Jollibee FoodPanda","163990","Jollibee - Pagbilao Highway","KM5 National Road Barangay Talipan Pagbilao Quezon 1st District 7Q53XM52+JR","Pagbilao","QUE","4302","PH","13.95907885","121.65186225","+639622950071"
"Jollibee FoodPanda","28766","Jollibee - Lucky Gold Lifehomes","Luckygold Plaza, Lifehomes, Ortigas Ave, Pasig, Metro Manila, Philippines (7Q63H3RV+4X)","Pasig","MET","1600","PH","14.5902659","121.0950351","+639175790628"
"Jollibee FoodPanda","44154","Jollibee - Kumintang","De Joya Street Barangay Kumintang Ilaya 2nd District","Batangas City","BAT","4200","PH","13.77148655","121.06554745","+639204241548"
"Jollibee FoodPanda","38985","Jollibee - Mega Shell","Maharlika Highway Corner Del Pilar Avenue Barangay Banggot 3rd District","Cabanatuan","NEC","3100","PH","15.49324915","120.97552315","+639067173093"
"Jollibee FoodPanda","16906","Jollibee - Jones","Arlington Road cor. Osmena Blvd.","Cebu","CEB","6000","PH","10.3070036","123.89427105","+639233735136"
"Jollibee FoodPanda","28210","Jollibee - Phoenix Lanang","Phoenix JP Laurel Avenue Alfonso Anglionto St","Davao City Davao","DAV","8000","PH","7.1010594","125.6308593","+639300501913"
"Jollibee FoodPanda","85657","Jollibee - Polomolok DT","National Highway Barangay Polomolok 1st District","General Santos City","SOU","9504","PH","6.21844165","125.061012","+639501450114"
"Jollibee FoodPanda","18637","Jollibee - Circumferential","Along Maharlika Highway corner Circumferrential Rd.","Cabanatuan","NEC","3100","PH","15.470474","120.9556241","+639082157064"
"Jollibee FoodPanda","50153","Jollibee - Zambo San Jose Road","Calle San Jose Corner Ruste Street Gusu Zamboanga City 1st District","Zamboanga","ZAM","7000","PH","6.9125238","122.0653508","+639657365162"
"Jollibee FoodPanda","28122","Jollibee - Buhangin Diversion NHA","Diversion Rd KM7 NHA Cabantian","Davao City Davao","DAV","9000","PH","7.11511715","125.62418355","+639655426246"
"Jollibee FoodPanda","28149","Jollibee - Cebu Oriente","Oriente Colonade Colon cor Legaspi Sts","Cebu","CEB","8000","PH","10.2965616","123.8993217","+639563569122"
"Jollibee FoodPanda","28311","Jollibee - Kalayaan","Kalayaan Ave corner Capas st Brgy Nuevo","Makati","MET","1200","PH","14.558883","121.046574","+63284032746"
"Jollibee FoodPanda","28137","Jollibee - Tagum Highway DT","National Hi-way corner Pioneer Ave","Tagum","DDN","8100","PH","7.446769","125.809579","+639562362461"
"Jollibee FoodPanda","78727","Jollibee - Talamban DT","Governor M Cuenco Avenue Talamban 1st District","Cebu","CEB","6000","PH","10.3689437","123.9163847","+639283179453"
"Jollibee FoodPanda","19131","Jollibee - Butuan Highway DT","J.C. Aquino Ave.","Butuan Agusan Del","AGU","9000","PH","8.9434233","125.52136205","+639098479776"
"Jollibee FoodPanda","14821","Jollibee - Sta Ana","2422 Pedro Gil St., Sta. Ana","Manila","MET","1000","PH","14.58159243","121.01282842","+63282932253"
"Jollibee FoodPanda","15048","Jollibee - Mandaue Centro","A. Del Rosario Street, Mantuyong","Cebu","CEB","6000","PH","10.32810135","123.9425116","+639329323576"
"Jollibee FoodPanda","28702","Jollibee - Evangelista","Edsa Cor Evangelista Barangay Bangkal 1st District","Makati","MET","1200","PH","14.53935489","121.01232435","+639659023059"
"Jollibee FoodPanda","14771","Jollibee - UST Dapitan","1531 A.H Lacson St. cor Dapitan, Sampaloc, Manila 1008","Manila","MET","1000","PH","14.6128314","120.98946855","+63282526991"
"Jollibee FoodPanda","32996","Jollibee - Puregold Maypajo","Cu3Cu8 Ground Floor Puregold Maypajo Barangay 34 Jp Rizal Street 1st District","Caloocan","MET","1400","PH","14.63792305","120.9748566","+63282832556"
"Jollibee FoodPanda","19193","Jollibee - Sta. Maria","Jose Corazon de Jesus St., Poblacion, Sta. Maria","Malolos","BUL","3022","PH","14.818747","120.961441","+639686662413"
"Jollibee FoodPanda","19191","Jollibee - SF La Union 3 (Sevilla)","Along Mc Arthur National Highway, Barangay Sevilla, San Fernando City","Ilocos","ILO","2500","PH","16.60216815","120.31818215","+639177036560"
"Jollibee FoodPanda","10947","Jollibee - Cebu Lapu-lapu","Osmena Street, Poblacion, Lapu - Lapu","Lapu-Lapu City","CEB","6000","PH","10.3101051","123.9501088","+639451433537"
"Jollibee FoodPanda","31628","Jollibee - Bagong Barrio","G de Jesus Corner EDSA Barangay 139 1st District","Caloocan","MET","1400","PH","14.6577808","120.9979761","+63282880087"
"Jollibee FoodPanda","163310","Jollibee - Edsa Philtranco","Apelo Cruz Street Corner Edang Street Barangay San Roque Lone District 7Q63G2Q3+3M","Pasay","MET","1300","PH","14.5376875","121.0041875","+639051548638"
"Jollibee FoodPanda","30036","Jollibee - Boni Halcon","Corner Boni Avenue Halcon Street 1st District","Mandaluyong","MET","1550","PH","14.57538845","121.041676","+63284776195"
"Jollibee FoodPanda","19166","Jollibee - Baliuag Junction","Along Dona Remedios Trinidad H-way cor. Benigno Aquino, Jr. Ave.,","Malolos","BUL","3006","PH","14.96298195","120.8971727","+639188077065"
"Jollibee FoodPanda","33822","Jollibee - Malabon Concepcion","288 Gen Luna Street Corner Gov Pascual Concepcion 1st District","Malabon","MET","1470","PH","14.66956751","120.94688836","+63289833003"
"Jollibee FoodPanda","28320","Jollibee - Shaw Blvd Wack Wack","Shaw Blvd Wack Wack Greenhills","Mandaluyong","MET","1550","PH","14.5862601","121.0480182","+63282885134"
"Jollibee FoodPanda","136681","Jollibee - Trium Square","Shop 1 Trium Square Sen Gil J Puyat Avenue Barangay 23 1st District (7Q62HX3V+HX) (Near Gergian Construction and Trading)","Pasay","MET","1300","PH","14.55386635","120.9948605","+639431337222"
"Jollibee FoodPanda","15014","Jollibee - Dolores Junction","Olongapo - Gapan Rd.","San Fernando","PAM","2000","PH","15.0393186","120.68163415","+63454093146"
"Jollibee FoodPanda","146817","Jollibee - Angono Baytown","Manila East Road Venus Compound Barangay San Isidro Angono Rizal 1st District","Angono","RIZ","1930","PH","14.536207","121.1498649","+639276988965"
"Jollibee FoodPanda","129899","Jollibee - San Mateo Plaza","282 General Luna Avenue Santa Ana San Mateo Rizal 3rd District (7Q63M4V8+J3)","San Mateo","ISA","1850","PH","14.693985","121.1173035","+639269956344"
"Jollibee FoodPanda","31631","Jollibee - San Pedro Town Center","Magsaysay Road Barangay San Antonio 1st District","San Pedro","LAG","4023","PH","14.3679764","121.0506841","+639283721302"
"Jollibee FoodPanda","31059","Jollibee - 9TH AVENUE","9th Avenue Corner Rizal Avenue Extension Grace Park 1st District","Caloocan","MET","1400","PH","14.6504343","120.9839331","+63286327650"
"Jollibee FoodPanda","75366","Jollibee - Subic Argonaut","Argonaut Highway Corner Rizal Highway Gateway District Subic Bay Freeport Zone 1st District","Olongapo","ZAM","2200","PH","14.8228874","120.2988351","+639985515040"
"Jollibee FoodPanda","28770","Jollibee - C Raymundo","9544 C Raymundo Avenue Caniogan 1st District","Pasig","MET","1600","PH","14.5707267","121.0818953","+63286439816"
"Jollibee FoodPanda","28698","Jollibee - Antipolo Capitol","Antipolo Capitol Circumferential Road Barangay San Roque 1st District","Antipolo","RIZ","1870","PH","14.5832561","121.16866695","+63277456716"
"Jollibee FoodPanda","76647","Jollibee - Centennial","Centennial Road corner Kalayaan Road Barangay Magadalo Potol 1st District","Kawit","CAV","4104","PH","14.4284044","120.8941592","+639386458858"
"Jollibee FoodPanda","101734","Jollibee - Vermosa Ayala","Ground Floor Central Garden Ayala Malls Vermosa Daang Hari Road Barangay Pasong Buaya 1 3rd District","Imus","CAV","4103","PH","14.3855708","120.9610225","+639654231782"
"Jollibee FoodPanda","35605","Jollibee - Manhattan Parkway","Space 4 Ground Floor Manhattan Parkway Gen Malvar Street Barangay Soccorro Cubao 1st District","Quezon","QUE","1100","PH","14.6230386","121.0542087","+63282875503"
"Jollibee FoodPanda","14799","Jollibee - Gen Santos Ave","Level 1, General Santos Avenue, Lower Bicutan","Taguig","MET","1630","PH","14.488796","121.060767","+63285410899"
"Jollibee FoodPanda","154603","Jollibee - Binakayan Highway","Antero Soriano Highway Corner Medicion-NIA Diversion road Barangay Marulas Kawit Cavite (CWV7+XV6 Kawit, Cavite)","Kawit","CAV","4104","PH","14.44506585","120.91491215","+639297417742"
"Jollibee FoodPanda","19214","Jollibee - San Jose Antique","Carreta St., San Jose de Buenavista, Antique","Iloilo City","ILO","9200","PH","10.744622","121.941781","+63365407321"
"Jollibee FoodPanda","77296","Jollibee - Apalit","McArthur Highway corner Gonzales Avenue Barangay San Vicente 4th District","Apalit","PAM","2016","PH","14.9499482","120.7588691","+639151632011"
"Jollibee FoodPanda","156780","Jollibee - Dau Mc Arthur","Lot 8 Policarpio Trucking Compound Mc Arthur Hiway Dau Mabalacat Pampanga 1st District7Q725HGP+6X","Mabalacat","PAM","2010","PH","15.175562","120.587437","+639101602511"
"Jollibee FoodPanda","10954","Jollibee - Maysilo","Brgy Plainview Maysilo Circle cor. Boni Ave.","Mandaluyong","MET","1550","PH","14.576859","121.034983","+63285333205"
"Jollibee FoodPanda","15037","Jollibee - Cebu Liloan","National Highway, Poblacion, Liloan","Liloan","CEB","6000","PH","10.4020595","123.99965955","+639169879750"
"Jollibee FoodPanda","14781","Jollibee - STI Holdings","G/F STI Holdings Bldg, 6764 Ayala Ave.","Makati","MET","1200","PH","14.5561429","121.02184985","+63277548003"
"Jollibee FoodPanda","14813","Jollibee - Tycoon","Tycoon Plaza, Pearl drive Ortigas Center","Ortigas","MET","1600","PH","14.58149805","121.06104745","+63289970531"
"Jollibee FoodPanda","46416","Jollibee - Waltermart Munoz","1st Floor -watermart mall north edsa bgry. Veterans village Quezon city","Quezon","QUE","1105","PH","14.65712485","121.0208247","+63283321175"
"Jollibee FoodPanda","86920","Jollibee - Robinsons Calasiao","Level 1 Unit 118A Robinsons Place Urdaneta-Dagupan Road Barangay San Miguel Road 3rd District","Calasiao","PAN","2418","PH","16.02172105","120.3588245","+639189175813"
"Jollibee FoodPanda","89445","Jollibee - Robinsons Expansion","Level 1 Robinsons Novaliches Market Quirino Highway Barangay Pasong Putik Novaliches 5th District","Quezon","QUE","1121","PH","14.7350826","121.0558568","+639394221906"
"Jollibee FoodPanda","19192","Jollibee - Solano","Along J. P. Rizal Ave., Maharlika Highway cor. Gaddang St., Solano","San Jose","OCM","3709","PH","16.517362","121.182002","+639059400403"
"Jollibee FoodPanda","28350","Jollibee - Mendiola","Legarda corner Mendiola Streets","Manila","MET","1000","PH","14.6000948","120.990775","+63287359675"
"Jollibee FoodPanda","76081","Jollibee - Citymall Mandalagan","Lacson Street corner GM Cordova Avenue Barangay Mandalagan 2nd District","Bacolod City","NOC","6100","PH","10.6955707","122.9612454","+639302546241"
"Jollibee FoodPanda","43560","Jollibee - Citymall Goldenfields","Level 1 CityMall Goldenfields Araneta Avenue Barangay Singcang Airport Lone District","Bacolod City","NOC","6100","PH","10.6506361","122.9372665","+639271398127"
"Jollibee FoodPanda","44175","Jollibee - SM Legazpi","Tahao Road Barangay Bitano 2nd District","Legazpi City","ALB","4500","PH","13.14386085","123.74423935","+639196404492"
"Jollibee FoodPanda","18436","Jollibee - Iriga","Highway 1 JP Rizal St., San Roque, Iriga City Camarines Sur","Iriga","CAM","4431","PH","13.420672","123.410514","+639175451334"
"Jollibee FoodPanda","39095","Jollibee - Gaisano Iligan","Ground Floor Gaisano Iligan Roxas Avenue 1st District","Iligan","LAA","9200","PH","8.2308903","124.2410938","+639754033834"
"Jollibee FoodPanda","48631","Jollibee - Batangas Rizal","D Silang Road Barangay 16 3rd District","Batangas City","BAT","4200","PH","13.75631065","121.0580315","+632437237475"
"Jollibee FoodPanda","49954","Jollibee - Marbel KCC","KCC Mall Marbel 1st District","Koronadal South","SOU","9506","PH","6.49887485","124.84599315","+639999443529"
"Jollibee FoodPanda","19130","Jollibee - Aguinaldo Iligan","Roxas Avenue","Iligan","LAA","9200","PH","8.22763909","124.24055395","+639161403032"
"Jollibee FoodPanda","55129","Jollibee - Malolos Terminal Hub","Malolos Terminal Hub Mc Arthur Highway Bulihan 1st District","Malolos","BUL","3000","PH","14.85789665","120.81189235","+639605637262"
"Jollibee FoodPanda","15521","Jollibee - Rosario","Gualberto St. cor Carandang St., Poblacion","Rosario","CAV","4200","PH","13.84487534","121.20239794","+639982844118"
"Jollibee FoodPanda","18434","Jollibee - Tabaco","165 Ziga Avenue Basud Tabaco City,Albay","Tabaco","ALB","4511","PH","13.3574731","123.7299206","+639279910185"
"Jollibee FoodPanda","50157","Jollibee - Citmall Tetuan","Citymall Tetuan Level 1 Don Alfaro Street Tetuan Zamboanga City 1st District","Zamboanga","ZAM","7000","PH","6.91441305","122.08230595","+639063861736"
"Jollibee FoodPanda","94988","Jollibee - MAASIN","T. Oppus cor. Rafols Sts., Barangay Tunga-tunga, Maasin City 1st District","Maasin","SLE","6600","PH","10.13284195","124.83873345","+639178780485"
"Jollibee FoodPanda","50147","Jollibee - Dipolog DT","Rotonda Highway Turno Dipolog City Zamboanga del Norte 2nd district","Dipolog","ZAN","7100","PH","8.58381835","123.35088957","+639486301432"
"Jollibee FoodPanda","101730","Jollibee - Cotabato Drive Thru","Sinsuat Avenue Cor M Jarabelo Rosary Heights XI 1st District","Cotabato City","MAG","9600","PH","7.2016253","124.2391975","+639338686356"
"Jollibee FoodPanda","28276","Jollibee - Sum-ag","Villarosa St Corner Negros South Road","Bacolod City","NOC","6100","PH","10.6032617","122.92021695","+639185746542"
"Jollibee FoodPanda","28270","Jollibee - Bacolod Libertad","Libertad Town Center Mabini cor Libertad Sts","Bacolod City","NOC","6100","PH","10.66056121","122.9491242","+639088100418"
"Jollibee FoodPanda","39239","Jollibee - SM Center Ormoc","Level 1 SM Center Ormoc Real Street Barangay District 14 4th Disitrict","Ormoc","LEY","6541","PH","11.0106317","124.607412","+639479962509"
"Jollibee FoodPanda","90754","Jollibee - Citymall Dipolog","Citymall Dipolog Dipolog-Oroquieta National Road Santa Filomena 1st District","Dipolog","ZAN","7100","PH","8.5709514","123.3391945","+639639613985"
"Jollibee FoodPanda","94817","Jollibee - Gaisano Grand Mall of Tagum","Gaisano Grand Mall of Tagum Purok Bayabas Apokon Street 1st District","Tagum","DDN","8100","PH","7.445828","125.8110062","+639276419054"
"Jollibee FoodPanda","18431","Jollibee - Sorsogon","LKY Mall, Magsaysay Street, Sorsogon, Sorsogon City","Sorsogon City","SOR","4700","PH","12.9703086","124.00656105","+639291889889"
"Jollibee FoodPanda","125440","Jollibee - Robinsons La Union","L1 Unit 103 Robinsons Place La Union MacArthur Highway Barangay Sevilla 1st District (7Q82J829+4C)","San Fernando","PAM","2500","PH","16.6001996","120.3187091","+639954354518"
"Jollibee FoodPanda","50148","Jollibee - SJDM Starmall","Barangay Kaypian City of San Jose Del Monte Bulacan 1st District","San Jose Del Monte","BUL","3017","PH","14.81425665","121.07181845","+639553276594"
"Jollibee FoodPanda","74442","Jollibee - Citymall Tuguegarao","Maharlika Highway Barangay Leonarda 1st District","Tuguegarao City","CAG","3500","PH","17.63326879","121.73531414","+639354221231"
"Jollibee FoodPanda","100150","JOLLIBEE - Lima Malvar","JP Laurel Highway Barangay Santiago Malvar 3rd District","Batangas City","BAT","4233","PH","14.0085057","121.1652524","+639672561060"
"Jollibee FoodPanda","74583","Jollibee - SM Urdaneta Central","Level 1 SM Urdaneta Central Mc Arthur Highway Barangay Nancayasan 5th District","Ilocos","ILO","2438","PH","15.97122425","120.5730073","+63755232884"
"Jollibee FoodPanda","16922","Jollibee - Davao DMC Drive-Thru","JP Laurel Ave.","Davao City Davao","DAV","8000","PH","7.097047","125.619468","+639434902792"
"Jollibee FoodPanda","24751","Jollibee - Kauswagan Diversion","San Pedro St., Kauswagan","Cagayan De Oro Misamis","MIS","9000","PH","8.502909","124.642012","+639176548000"
"Jollibee FoodPanda","34824","Jollibee - Gaisano Tacloban","Gaisano Central Justice Romualdez Street 1st District","Tacloban","LEY","6500","PH","11.2460134","125.0028286","+639772117189"
